pid,title,year,journal_title,source_file,input_text_hash,field,critical_field,consensus_level,decision,consensus_value,agent_a_value,agent_b_value,agent_c_value,agent_a_valid,agent_b_valid,agent_c_valid,n_valid,n_distinct_values,top_n,fidelity_issue_n,high_severity_n,medium_severity_n,low_severity_n,fidelity_agents_with_issue,fidelity_statuses,disagreement_flag,priority_score,adjudication_reason
S0102-69092006000100007,Desprovincializando a sociologia: a contribuição pós-colonial,2006,Revista Brasileira de Ciências Sociais,data/processed/fulltext_gold/article_texts_gold.csv,a91df8432d3b10f7901fbd06168294ce905ec6dd5d4e4c0f938d8136ed024947,brief_justification,FALSE,no_majority,adjudicate,,"O corpo de ""Desprovincializando a sociologia: a contribuição pós-colonial"" se apresenta como ensaio teórico, conceitual ou de história das ideias, sem análise própria de dados observacionais ou experimentais. Por isso, os campos de desenho causal, variáveis, amostra e resultados estatísticos foram deixados nulos.","O artigo ""Desprovincializando a sociologia: a contribuição pós-colonial"" é tratado como ensaio teórico, conceitual ou histórico-intelectual. Não há análise empírica quantitativa própria nem desenho de identificação causal sustentado pelo corpo do texto.","O body canônico apresenta uma discussão conceitual, interpretativa ou histórica, sem análise própria de dados observacionais ou experimentais. Não há amostra, variáveis, equações estimadas ou resultados estatísticos sustentados pelo texto.",TRUE,TRUE,TRUE,3,3,1,0,0,0,0,,,TRUE,2,desacordo_entre_agentes
S0102-69092006000300006,A sociologia de Gramsci,2006,Revista Brasileira de Ciências Sociais,data/processed/fulltext_gold/article_texts_gold.csv,56a2650d3d6f0c453d570eb3ea8f52d1bcdd752f3f2c003d62d2224ea29b0cbf,brief_justification,FALSE,no_majority,adjudicate,,"O corpo de ""A sociologia de Gramsci"" se apresenta como ensaio teórico, conceitual ou de história das ideias, sem análise própria de dados observacionais ou experimentais. Por isso, os campos de desenho causal, variáveis, amostra e resultados estatísticos foram deixados nulos.","O artigo ""A sociologia de Gramsci"" é tratado como ensaio teórico, conceitual ou histórico-intelectual. Não há análise empírica quantitativa própria nem desenho de identificação causal sustentado pelo corpo do texto.","O body canônico apresenta uma discussão conceitual, interpretativa ou histórica, sem análise própria de dados observacionais ou experimentais. Não há amostra, variáveis, equações estimadas ou resultados estatísticos sustentados pelo texto.",TRUE,TRUE,TRUE,3,3,1,0,0,0,0,,,TRUE,2,desacordo_entre_agentes
S0102-69092008000300012,"Goffman, mal-entendidos e riscos interacionais",2008,Revista Brasileira de Ciências Sociais,data/processed/fulltext_gold/article_texts_gold.csv,d07e0cc0770608ac6418aaba47866ad6ef6caa6a182ecb58a2568a4d277df9e0,brief_justification,FALSE,no_majority,adjudicate,,"O corpo de ""Goffman, mal-entendidos e riscos interacionais"" se apresenta como ensaio teórico, conceitual ou de história das ideias, sem análise própria de dados observacionais ou experimentais. Por isso, os campos de desenho causal, variáveis, amostra e resultados estatísticos foram deixados nulos.","O artigo ""Goffman, mal-entendidos e riscos interacionais"" é tratado como ensaio teórico, conceitual ou histórico-intelectual. Não há análise empírica quantitativa própria nem desenho de identificação causal sustentado pelo corpo do texto.","O body canônico apresenta uma discussão conceitual, interpretativa ou histórica, sem análise própria de dados observacionais ou experimentais. Não há amostra, variáveis, equações estimadas ou resultados estatísticos sustentados pelo texto.",TRUE,TRUE,TRUE,3,3,1,0,0,0,0,,,TRUE,2,desacordo_entre_agentes
S0102-69092009000100011,"Élide, Gilberto, imagismo e língua de universidade",2009,Revista Brasileira de Ciências Sociais,data/processed/fulltext_gold/article_texts_gold.csv,2321359344e91874d52635d103101d70acdc193cd944cdddf1d6f0269b1f76a2,brief_justification,FALSE,no_majority,adjudicate,,"O corpo de ""Élide, Gilberto, imagismo e língua de universidade"" se apresenta como ensaio teórico, conceitual ou de história das ideias, sem análise própria de dados observacionais ou experimentais. Por isso, os campos de desenho causal, variáveis, amostra e resultados estatísticos foram deixados nulos.","O artigo ""Élide, Gilberto, imagismo e língua de universidade"" é tratado como ensaio teórico, conceitual ou histórico-intelectual. Não há análise empírica quantitativa própria nem desenho de identificação causal sustentado pelo corpo do texto.","O body canônico apresenta uma discussão conceitual, interpretativa ou histórica, sem análise própria de dados observacionais ou experimentais. Não há amostra, variáveis, equações estimadas ou resultados estatísticos sustentados pelo texto.",TRUE,TRUE,TRUE,3,3,1,0,0,0,0,,,TRUE,2,desacordo_entre_agentes
S0102-69092010000100013,Os fantasmas da memória,2010,Revista Brasileira de Ciências Sociais,data/processed/fulltext_gold/article_texts_gold.csv,c11f118db2b3967cd9189683ea5c43251e471b2203d36790784846b5b9565c7f,brief_justification,FALSE,no_majority,adjudicate,,"O corpo de ""Os fantasmas da memória"" se apresenta como ensaio teórico, conceitual ou de história das ideias, sem análise própria de dados observacionais ou experimentais. Por isso, os campos de desenho causal, variáveis, amostra e resultados estatísticos foram deixados nulos.","O artigo ""Os fantasmas da memória"" é tratado como ensaio teórico, conceitual ou histórico-intelectual. Não há análise empírica quantitativa própria nem desenho de identificação causal sustentado pelo corpo do texto.","O body canônico apresenta uma discussão conceitual, interpretativa ou histórica, sem análise própria de dados observacionais ou experimentais. Não há amostra, variáveis, equações estimadas ou resultados estatísticos sustentados pelo texto.",TRUE,TRUE,TRUE,3,3,1,0,0,0,0,,,TRUE,2,desacordo_entre_agentes
S0102-69092011000100008,Regras de jogo versus regras morais: para uma teoria sociológica do fair play,2011,Revista Brasileira de Ciências Sociais,data/processed/fulltext_gold/article_texts_gold.csv,1075a1541a738fa7b0d431b309c7ccb8739bb6b5dea6daca2df84e5c3659faff,brief_justification,FALSE,no_majority,adjudicate,,"O corpo de ""Regras de jogo versus regras morais: para uma teoria sociológica do fair play"" se apresenta como ensaio teórico, conceitual ou de história das ideias, sem análise própria de dados observacionais ou experimentais. Por isso, os campos de desenho causal, variáveis, amostra e resultados estatísticos foram deixados nulos.","O artigo ""Regras de jogo versus regras morais: para uma teoria sociológica do fair play"" é tratado como ensaio teórico, conceitual ou histórico-intelectual. Não há análise empírica quantitativa própria nem desenho de identificação causal sustentado pelo corpo do texto.","O body canônico apresenta uma discussão conceitual, interpretativa ou histórica, sem análise própria de dados observacionais ou experimentais. Não há amostra, variáveis, equações estimadas ou resultados estatísticos sustentados pelo texto.",TRUE,TRUE,TRUE,3,3,1,0,0,0,0,,,TRUE,2,desacordo_entre_agentes
S0102-69092012000200009,Reconsiderando a etnografia da ciência e da tecnologia: tecnociência na prática,2012,Revista Brasileira de Ciências Sociais,data/processed/fulltext_gold/article_texts_gold.csv,8d50aee8b6657e6d594f864c9a22e78bcbb2ae4c83029b793bf380a7c73aab19,brief_justification,FALSE,no_majority,adjudicate,,"O corpo de ""Reconsiderando a etnografia da ciência e da tecnologia: tecnociência na prática"" se apresenta como ensaio teórico, conceitual ou de história das ideias, sem análise própria de dados observacionais ou experimentais. Por isso, os campos de desenho causal, variáveis, amostra e resultados estatísticos foram deixados nulos.","O artigo ""Reconsiderando a etnografia da ciência e da tecnologia: tecnociência na prática"" é tratado como ensaio teórico, conceitual ou histórico-intelectual. Não há análise empírica quantitativa própria nem desenho de identificação causal sustentado pelo corpo do texto.","O body canônico apresenta uma discussão conceitual, interpretativa ou histórica, sem análise própria de dados observacionais ou experimentais. Não há amostra, variáveis, equações estimadas ou resultados estatísticos sustentados pelo texto.",TRUE,TRUE,TRUE,3,3,1,0,0,0,0,,,TRUE,2,desacordo_entre_agentes
S0102-69092013000300008,"Profissionalismo, diferença e diversidade na advocacia e na magistratura paulistas",2013,Revista Brasileira de Ciências Sociais,data/processed/fulltext_gold/article_texts_gold.csv,a3bdd79e00654fc01de667f994026b36b89912bbbb8db6537e7b5e685cc79cf0,brief_justification,FALSE,no_majority,adjudicate,,"O corpo de ""Profissionalismo, diferença e diversidade na advocacia e na magistratura paulistas"" conduz análise empírica qualitativa ou histórico-documental, não uma análise quantitativa de dados observacionais ou experimentais. Os campos estatísticos e de desenho causal foram preenchidos apenas quando o método estava claramente declarado no texto.","O artigo ""Profissionalismo, diferença e diversidade na advocacia e na magistratura paulistas"" é uma análise qualitativa, documental ou de campo. O método pode ser explícito, mas o texto não sustenta análise quantitativa própria nem desenho causal de identificação.","O artigo combina dados quantitativos coletados em sites de 200 sociedades de advogados com entrevistas qualitativas. A evidência é mista e descritiva, sem modelo estatístico causal.",TRUE,TRUE,TRUE,3,3,1,0,0,0,0,,,TRUE,2,desacordo_entre_agentes
S0102-69092015000200045,Pós-estruturalismo e a crítica como repetição,2015,Revista Brasileira de Ciências Sociais,data/processed/fulltext_gold/article_texts_gold.csv,22cc1497b5f50d6e38657a44167b6a533879f61af325fa9e2ee3f1664af1bee9,brief_justification,FALSE,no_majority,adjudicate,,"O corpo de ""Pós-estruturalismo e a crítica como repetição"" se apresenta como ensaio teórico, conceitual ou de história das ideias, sem análise própria de dados observacionais ou experimentais. Por isso, os campos de desenho causal, variáveis, amostra e resultados estatísticos foram deixados nulos.","O artigo ""Pós-estruturalismo e a crítica como repetição"" é tratado como ensaio teórico, conceitual ou histórico-intelectual. Não há análise empírica quantitativa própria nem desenho de identificação causal sustentado pelo corpo do texto.","O body canônico apresenta uma discussão conceitual, interpretativa ou histórica, sem análise própria de dados observacionais ou experimentais. Não há amostra, variáveis, equações estimadas ou resultados estatísticos sustentados pelo texto.",TRUE,TRUE,TRUE,3,3,1,0,0,0,0,,,TRUE,2,desacordo_entre_agentes
S0102-69092018000300507,O OVO E A GALINHA. Estudo do enquadramento e da recepção da cobertura jornalística no pleito de 2014,2018,Revista Brasileira de Ciências Sociais,data/processed/fulltext_gold/article_texts_gold.csv,d06db8a6e911c0c2c7a0c7ca4a10b6f06dfab66712abbc099170b5f547c8fbbb,brief_justification,FALSE,no_majority,adjudicate,,"O corpo de ""O OVO E A GALINHA. Estudo do enquadramento e da recepção da cobertura jornalística no pleito de 2014"" combina evidência quantitativa com documentos, entrevistas, análise de conteúdo ou estudo de caso. Mantive nulos os campos de identificação causal, placebo e relações IV-DV quando o texto não sustentava uma leitura causal precisa.","O artigo ""O OVO E A GALINHA. Estudo do enquadramento e da recepção da cobertura jornalística no pleito de 2014"" usa dados quantitativos para explicar um outcome por variáveis observacionais. A linguagem de efeito/determinantes foi classificada conservadoramente: não há estimando causal claro nem suposições substantivas de identificação, portanto a quantidade causal é FALSE.","O artigo usa survey nacional e modelos logísticos multinomiais para examinar associação entre exposição a mídia, avaliação da economia e avaliação do governo. Há análise quantitativa com controles e significância, mas o próprio desenho é observacional/correlacional.",TRUE,TRUE,TRUE,3,3,1,0,0,0,0,,,TRUE,2,desacordo_entre_agentes
S0102-69092018000300507,O OVO E A GALINHA. Estudo do enquadramento e da recepção da cobertura jornalística no pleito de 2014,2018,Revista Brasileira de Ciências Sociais,data/processed/fulltext_gold/article_texts_gold.csv,d06db8a6e911c0c2c7a0c7ca4a10b6f06dfab66712abbc099170b5f547c8fbbb,independent_variables,FALSE,no_majority,adjudicate,,"[{""variable_name"":""use of specific media outlets"",""variable_description"":""Explanatory variable identified from the article body.""}]","[{""variable_name"":""Media exposure"",""variable_description"":""Exposure to specific news outlets or journalistic frames during the 2014 election.""}]","[{""variable_name"":""media_exposure"",""variable_description"":""Exposição ao Jornal Nacional, O Globo e Folha de S. Paulo""},{""variable_name"":""sociodemographic_controls"",""variable_description"":""Sexo, idade, escolaridade, classe social e região""}]",TRUE,TRUE,TRUE,3,3,1,0,0,0,0,,supported_by_text,TRUE,2,desacordo_entre_agentes
S0102-69092018000300507,O OVO E A GALINHA. Estudo do enquadramento e da recepção da cobertura jornalística no pleito de 2014,2018,Revista Brasileira de Ciências Sociais,data/processed/fulltext_gold/article_texts_gold.csv,d06db8a6e911c0c2c7a0c7ca4a10b6f06dfab66712abbc099170b5f547c8fbbb,specifies_estimate_equations,FALSE,no_majority,adjudicate,,<NULL>,TRUE,FALSE,TRUE,TRUE,TRUE,3,3,1,0,0,0,0,,supported_by_text,TRUE,2,desacordo_entre_agentes
S0102-69092019000200505,CLASSE SOCIAL E ALIMENTAÇÃO: PADRÕES DE CONSUMO ALIMENTAR NO BRASIL CONTEMPORÂNEO,2019,Revista Brasileira de Ciências Sociais,data/processed/fulltext_gold/article_texts_gold.csv,f9570a8d115db3eaf9cac0deca47b006cf4e2e57287e23cd0655890a5a40d7c3,brief_justification,FALSE,no_majority,adjudicate,,"O corpo de ""CLASSE SOCIAL E ALIMENTAÇÃO: PADRÕES DE CONSUMO ALIMENTAR NO BRASIL CONTEMPORÂNEO"" analisa dados quantitativos, administrativos ou de survey com procedimento empírico próprio ou secundário claramente descrito. A classificação é conservadora: detalhes causais, variáveis e identificação só foram preenchidos quando o texto os declarou de forma explícita.","O artigo ""CLASSE SOCIAL E ALIMENTAÇÃO: PADRÕES DE CONSUMO ALIMENTAR NO BRASIL CONTEMPORÂNEO"" conduz análise quantitativa própria ou secundária, predominantemente descritiva/associacional. Não identifiquei desenho de identificação causal, estimando causal ou suposições de identificação no texto.","O artigo usa microdados da POF e análise de correspondências para descrever padrões de consumo alimentar por classe. A análise é quantitativa descritiva/relacional, sem desenho causal ou resultados de significância.",TRUE,TRUE,TRUE,3,3,1,0,0,0,0,,,TRUE,2,desacordo_entre_agentes
S0102-69092019000300509,EXISTEM PREFERÊNCIAS DE SEXO NO BRASIL?,2019,Revista Brasileira de Ciências Sociais,data/processed/fulltext_gold/article_texts_gold.csv,1b85168ae86cd2f1d95fbf408cabac31c2dbbce6583466bba00885ff97b6366f,brief_justification,FALSE,no_majority,adjudicate,,"O corpo de ""EXISTEM PREFERÊNCIAS DE SEXO NO BRASIL?"" analisa dados quantitativos, administrativos ou de survey com procedimento empírico próprio ou secundário claramente descrito. A classificação é conservadora: detalhes causais, variáveis e identificação só foram preenchidos quando o texto os declarou de forma explícita.","O artigo ""EXISTEM PREFERÊNCIAS DE SEXO NO BRASIL?"" conduz análise quantitativa própria ou secundária, predominantemente descritiva/associacional. Não identifiquei desenho de identificação causal, estimando causal ou suposições de identificação no texto.","O artigo usa PNDS/DHS e modelos logísticos multinomiais para examinar preferências de sexo no Brasil. As bases são surveys públicos e nacionais, com análise estatística observacional, sem desenho causal identificado.",TRUE,TRUE,TRUE,3,3,1,0,0,0,0,,,TRUE,2,desacordo_entre_agentes
S0102-69092019000300509,EXISTEM PREFERÊNCIAS DE SEXO NO BRASIL?,2019,Revista Brasileira de Ciências Sociais,data/processed/fulltext_gold/article_texts_gold.csv,1b85168ae86cd2f1d95fbf408cabac31c2dbbce6583466bba00885ff97b6366f,discusses_threats_to_causality,FALSE,no_majority,adjudicate,,FALSE,<NULL>,TRUE,TRUE,TRUE,TRUE,3,3,1,0,0,0,0,,,TRUE,2,desacordo_entre_agentes
S0102-69092020000100513,AUTORIDADE PRIVADA NA GOVERNANÇA DA INTERNET: Regimes de nomes e domínios na América Latina,2020,Revista Brasileira de Ciências Sociais,data/processed/fulltext_gold/article_texts_gold.csv,d45f1ab28fa8f2a7aea8d04d150417f18d8914ee3287025dc692f93470e6941a,brief_justification,FALSE,no_majority,adjudicate,,"O corpo de ""AUTORIDADE PRIVADA NA GOVERNANÇA DA INTERNET: Regimes de nomes e domínios na América Latina"" conduz análise empírica qualitativa ou histórico-documental, não uma análise quantitativa de dados observacionais ou experimentais. Os campos estatísticos e de desenho causal foram preenchidos apenas quando o método estava claramente declarado no texto.","O artigo ""AUTORIDADE PRIVADA NA GOVERNANÇA DA INTERNET: Regimes de nomes e domínios na América Latina"" é uma análise qualitativa, documental ou de campo. O método pode ser explícito, mas o texto não sustenta análise quantitativa própria nem desenho causal de identificação.","O body canônico sustenta uma análise qualitativa, histórica ou documental do tema, sem banco quantitativo próprio, survey, equações estimadas ou resultados estatísticos.",TRUE,TRUE,TRUE,3,3,1,0,0,0,0,,,TRUE,2,desacordo_entre_agentes
S0102-69092021000100510,TECENDO UM CIRCUITO COMERCIAL A PARTIR DA FEIRA DA MADRUGADA As agenciadoras da moda popular brasileira,2021,Revista Brasileira de Ciências Sociais,data/processed/fulltext_gold/article_texts_gold.csv,e58929b7f984f6d6fcef8884ee4f7b394baebfadce50802952aed401771910c1,brief_justification,FALSE,no_majority,adjudicate,,"O corpo de ""TECENDO UM CIRCUITO COMERCIAL A PARTIR DA FEIRA DA MADRUGADA As agenciadoras da moda popular brasileira"" conduz análise empírica qualitativa ou histórico-documental, não uma análise quantitativa de dados observacionais ou experimentais. Os campos estatísticos e de desenho causal foram preenchidos apenas quando o método estava claramente declarado no texto.","O artigo ""TECENDO UM CIRCUITO COMERCIAL A PARTIR DA FEIRA DA MADRUGADA As agenciadoras da moda popular brasileira"" é uma análise qualitativa, documental ou de campo. O método pode ser explícito, mas o texto não sustenta análise quantitativa própria nem desenho causal de identificação.","O artigo usa etnografia e entrevistas semiestruturadas para analisar o circuito comercial da Feira da Madrugada. A evidência é qualitativa, sem análise estatística própria.",TRUE,TRUE,TRUE,3,3,1,0,0,0,0,,,TRUE,2,desacordo_entre_agentes
S0102-69092024000100506,Determinantes da equidade na implementação da Política Nacional de Assistência Social,2024,Revista Brasileira de Ciências Sociais,data/processed/fulltext_gold/article_texts_gold.csv,25933eee5bfdc0905344dca6c3a3293ce3eedea4aff7e084f8a10ee90499d770,brief_justification,FALSE,no_majority,adjudicate,,"O corpo de ""Determinantes da equidade na implementação da Política Nacional de Assistência Social"" analisa dados quantitativos, administrativos ou de survey com procedimento empírico próprio ou secundário claramente descrito. A classificação é conservadora: detalhes causais, variáveis e identificação só foram preenchidos quando o texto os declarou de forma explícita.","O artigo ""Determinantes da equidade na implementação da Política Nacional de Assistência Social"" usa dados quantitativos para explicar um outcome por variáveis observacionais. A linguagem de efeito/determinantes foi classificada conservadoramente: não há estimando causal claro nem suposições substantivas de identificação, portanto a quantidade causal é FALSE.","O artigo usa desenho quantitativo com regressões logísticas para estudar determinantes da equidade na implementação da assistência social. O texto explicita que, dadas as exigências fortes de inferência causal, estima correlações.",TRUE,TRUE,TRUE,3,3,1,0,0,0,0,,,TRUE,2,desacordo_entre_agentes
S0102-69092025000100509,Negligência ou Genocídio? A crise humanitária na Terra Indígena Yanomami no Brasil,2025,Revista Brasileira de Ciências Sociais,data/processed/fulltext_gold/article_texts_gold.csv,1fb0a14524471b0fe2baa476ae2a4d58f343e4bc73963b7887238759a01c5e4d,brief_justification,FALSE,no_majority,adjudicate,,"O corpo de ""Negligência ou Genocídio? A crise humanitária na Terra Indígena Yanomami no Brasil"" conduz análise empírica qualitativa ou histórico-documental, não uma análise quantitativa de dados observacionais ou experimentais. Os campos estatísticos e de desenho causal foram preenchidos apenas quando o método estava claramente declarado no texto.","O artigo ""Negligência ou Genocídio? A crise humanitária na Terra Indígena Yanomami no Brasil"" apresenta argumento qualitativo explicativo com linguagem causal ou processual. Como não define estimando nem suposições de identificação, classifiquei o desenho como Other e a quantidade causal como FALSE.","O body canônico sustenta uma análise qualitativa, histórica ou documental do tema, sem banco quantitativo próprio, survey, equações estimadas ou resultados estatísticos.",TRUE,TRUE,TRUE,3,3,1,0,0,0,0,,,TRUE,2,desacordo_entre_agentes
S0102-85292005000100003,O novo regionalismo econômico asiático,2005,Contexto Internacional,data/processed/fulltext_gold/article_texts_gold.csv,164ef0f7c701aaa458922d5771206685e7a97eda3a297ec5c3e0cfb66dd35748,brief_justification,FALSE,no_majority,adjudicate,,"O corpo de ""O novo regionalismo econômico asiático"" conduz análise empírica qualitativa ou histórico-documental, não uma análise quantitativa de dados observacionais ou experimentais. Os campos estatísticos e de desenho causal foram preenchidos apenas quando o método estava claramente declarado no texto.","O artigo ""O novo regionalismo econômico asiático"" é uma análise qualitativa, documental ou de campo. O método pode ser explícito, mas o texto não sustenta análise quantitativa própria nem desenho causal de identificação.","O body canônico apresenta uma discussão conceitual, interpretativa ou histórica, sem análise própria de dados observacionais ou experimentais. Não há amostra, variáveis, equações estimadas ou resultados estatísticos sustentados pelo texto.",TRUE,TRUE,TRUE,3,3,1,0,0,0,0,,,TRUE,2,desacordo_entre_agentes
S0102-85292006000100007,O local e o global na estrutura da política ambiental internacional: a construção social do acidente químico ampliado de Bhopal e da Convenção 174 da OIT,2006,Contexto Internacional,data/processed/fulltext_gold/article_texts_gold.csv,0bf72334c7d9d57678be91bfa00345d395084596a30e6e391522bea95eb217bc,brief_justification,FALSE,no_majority,adjudicate,,"O corpo de ""O local e o global na estrutura da política ambiental internacional: a construção social do acidente químico ampliado de Bhopal e da Convenção 174 da OIT"" conduz análise empírica qualitativa ou histórico-documental, não uma análise quantitativa de dados observacionais ou experimentais. Os campos estatísticos e de desenho causal foram preenchidos apenas quando o método estava claramente declarado no texto.","O artigo ""O local e o global na estrutura da política ambiental internacional: a construção social do acidente químico ampliado de Bhopal e da Convenção 174 da OIT"" é uma análise qualitativa, documental ou de campo. O método pode ser explícito, mas o texto não sustenta análise quantitativa própria nem desenho causal de identificação.","O body canônico sustenta uma análise qualitativa, histórica ou documental do tema, sem banco quantitativo próprio, survey, equações estimadas ou resultados estatísticos.",TRUE,TRUE,TRUE,3,3,1,0,0,0,0,,,TRUE,2,desacordo_entre_agentes
S0102-85292006000100007,O local e o global na estrutura da política ambiental internacional: a construção social do acidente químico ampliado de Bhopal e da Convenção 174 da OIT,2006,Contexto Internacional,data/processed/fulltext_gold/article_texts_gold.csv,0bf72334c7d9d57678be91bfa00345d395084596a30e6e391522bea95eb217bc,seeks_determinants,FALSE,no_majority,adjudicate,,TRUE,FALSE,<NULL>,TRUE,TRUE,TRUE,3,3,1,0,0,0,0,,,TRUE,2,desacordo_entre_agentes
