denominator,n,denominator_reference,denominator_n,percent
Corpus completo elegível,5250,manifest completo,5250,100
Artigos classificados por leitura integral,799,manifest completo,5250,15.2
Artigos ainda não classificados,4451,manifest completo,5250,84.8
Artigos empíricos classificados,647,classificados,799,81
Artigos empíricos quantitativos classificados,349,classificados,799,43.7
Artigos com claim causal ou explicativo classificados,682,classificados,799,85.4
Artigos no screen de credibilidade classificados,150,classificados,799,18.8
Artigos classificados com desenho estrito,16,classificados,799,2
