journal_title,n_articles,n_empirical,n_quantitative,n_inference,n_inference_observed,n_inference_missing,n_claim,n_empirical_claim,n_screen,n_strict,pct_empirical,pct_quantitative,pct_inference,pct_claim,pct_claim_all,pct_screen,pct_strict
Brazilian Political Science Review,268,231,171,85,171,0,237,228,108,13,86.2,74,49.7,98.7,88.4,40.3,12
Cadernos Gestão Pública e Cidadania,120,106,75,14,75,0,100,95,24,2,88.3,70.8,18.7,89.6,83.3,20,8.3
Contexto Internacional,456,345,111,8,111,0,383,336,19,1,75.7,32.2,7.2,97.4,84,4.2,5.3
Dados,622,542,340,142,340,0,552,523,198,10,87.1,62.7,41.8,96.5,88.7,31.8,5.1
Opinião Pública,451,426,390,238,388,2,434,412,351,19,94.5,91.5,61.3,96.7,96.2,77.8,5.4
Revista Brasileira de Ciência Política,391,290,184,60,183,1,360,279,138,4,74.2,63.4,32.8,96.2,92.1,35.3,2.9
Revista Brasileira de Ciências Sociais,708,548,235,68,235,0,667,538,177,4,77.4,42.9,28.9,98.2,94.2,25,2.3
Revista Brasileira de Política Internacional,490,434,158,14,158,0,477,427,110,0,88.6,36.4,8.9,98.4,97.3,22.4,0
Revista de Sociologia e Política,638,492,335,114,333,2,592,485,270,6,77.1,68.1,34.2,98.6,92.8,42.3,2.2
