pid,title,journal_title,year,eligible_order,empirical_evidence_type,quantitative_analysis_type,credibility_revolution_screen_reason,tough_call_reason
S2236-57102024000100201,OLHAR DOS ESTUDOS ORGANIZACIONAIS PARA SE PENSAR A REFORMA DAS ORGANIZAÇÕES POLICIAIS NO BRASIL,Cadernos Gestão Pública e Cidadania,2024,304,none,none,not_empirical,"A introdução descreve um processo qualitativo de sistematização de literatura e menciona 137 artigos, mas o artigo se declara ensaio teórico e não apresenta análise empírica substantiva própria; por isso, a busca bibliográfica foi tratada como apoio a revisão teórica, não como evidência empírica original."
S2236-57102024000100202,INCENTIVOS À TRANSIÇÃO DE CARREIRA DOS BUROCRATAS DE MÉDIO ESCALÃO,Cadernos Gestão Pública e Cidadania,2024,305,mixed_empirical,descriptive_statistics_only,descriptive_quantitative_only,"A principal evidência é qualitativa, mas o artigo também apresenta análise descritiva de processos seletivos da PGFN. Classifiquei como mixed_empirical e quantitative descriptive only porque esses números são usados empiricamente para caracterizar a baixa concorrência, embora a análise substantiva central seja qualitativa."
S2236-57102024000100203,"CONSTITUIÇÃO, EMENDAS CONSTITUCIONAIS E POLÍTICAS PÚBLICAS: A ATENÇÃO GOVERNAMENTAL EM MUDANÇAS CONSTITUCIONAIS",Cadernos Gestão Pública e Cidadania,2024,306,mixed_empirical,descriptive_statistics_only,causal_claim_with_quantitative_analysis_screen,"O artigo é essencialmente descritivo e baseado em análise de conteúdo, mas usa linguagem explicativa e causal sobre emendas, agendas de governo e mudanças constitucionais. Isso justifica a triagem por causal claim with quantitative analysis, embora não haja desenho causal de credibilidade nem inferência estatística."
S2236-57102024000100204,FATORES FISCAIS E SOCIOECONÔMICOS QUE AFETAM A CRIMINALIDADE NO BRASIL,Cadernos Gestão Pública e Cidadania,2024,307,mixed_empirical,statistical_modeling,statistical_modeling_screen,"O artigo usa linguagem de impacto/efeito e modelos de painel com efeitos fixos e aleatórios, mas não apresenta lógica explícita de identificação causal; por isso, os modelos contam como statistical_modeling e passam pela triagem, mas não como método de credibilidade. Também há um componente documental/legislativo, embora o núcleo empírico seja quantitativo."
S2236-57102024000100205,ESTRUTURA E MECANISMOS DA GOVERNANÇA EM REDE NA IMPLEMENTAÇÃO DE POLÍTICAS PÚBLICAS,Cadernos Gestão Pública e Cidadania,2024,308,qualitative_only,none,qualitative_only,"O artigo contém alguns números contextuais sobre população e OSCs, mas eles não constituem análise quantitativa original; a classificação como qualitativo-only depende de distinguir contextualização numérica secundária de análise quantitativa substantiva."
S2236-57102024000100206,TRANSPARÊNCIA DOS BANCOS DE DESENVOLVIMENTO SUBNACIONAIS BRASILEIROS: ENTRE O SIGILO DA BUROCRACIA E A DEMOCRATIZAÇÃO DA INFORMAÇÃO,Cadernos Gestão Pública e Cidadania,2024,309,mixed_empirical,descriptive_statistics_only,descriptive_quantitative_only,"O artigo se autodefine como qualitativo e descritivo, mas a coleta codifica 33 itens em 0/1 e apresenta resultados tabulares de presença/ausência; por isso, para o schema Torreblanca, há análise quantitativa original, embora apenas descritiva."
S2236-57102024000100207,IDEOLOGIA IMPORTA? UMA ANÁLISE DOS PARECERES EMITIDOS PELOS TRIBUNAIS DE CONTAS BRASILEIROS,Cadernos Gestão Pública e Cidadania,2024,310,quantitative_only,statistical_modeling,statistical_modeling_screen,"A ACM é uma técnica multivariada e justifica `statistical_modeling`, mas o artigo também tem forte componente descritivo e linguagem de associação. A claim explicativa existe, porém não há estratégia causal de credibilidade ou identificação causal explícita."
S2236-57102024000100208,"MUDANÇAS TECNOLÓGICAS, TRABALHO E DESIGUALDADES NA AMÉRICA LATINA: REPENSAR AS ALTERNATIVAS DE PROTEÇÃO SOCIAL NO PÓS-PANDEMIA",Cadernos Gestão Pública e Cidadania,2024,311,none,none,not_empirical,"O artigo contém muitos indicadores secundários e menciona uma Figura 1, o que poderia sugerir análise descritiva quantitativa. No entanto, o corpo do texto atribui os números a relatórios e estudos de terceiros e não descreve base, coleta, reanálise, procedimento estatístico ou construção própria de dados pelos autores."
S2236-57102024000100209,LABORATÓRIOS DE INOVAÇÃO E BARREIRAS AO INTRAEMPREENDEDORISMO EM GOVERNOS,Cadernos Gestão Pública e Cidadania,2024,312,mixed_empirical,descriptive_statistics_only,descriptive_quantitative_only,"O artigo se autodefine como qualitativo, mas inclui tabulação de respostas em escala Likert e cálculo de médias para classificar barreiras. Por isso, a classificação adequada é mixed_empirical com componente quantitativa descritiva, embora a interpretação substantiva seja predominantemente qualitativa."
S2236-57102024000100211,SUS: USO DE EQUIPAMENTOS INOVADORES PARA DIAGNÓSTICO DO CÂNCER DE MAMA,Cadernos Gestão Pública e Cidadania,2024,314,quantitative_only,statistical_modeling,statistical_modeling_screen,"O artigo usa linguagem de impacto e estima modelo de efeitos fixos com dados em painel, mas não apresenta lógica de tratamento, comparação tratada-controle, intervenção temporal, tendências paralelas ou outro argumento explícito de identificação causal. Por isso passa pela triagem, mas não conta como método de credibilidade."
S2236-57102024000100212,PCC OU POLÍTICAS PÚBLICAS? UMA ANÁLISE DA REDUÇÃO DOS HOMICÍDIOS EM SÃO PAULO,Cadernos Gestão Pública e Cidadania,2024,315,quantitative_only,statistical_modeling,statistical_modeling_screen,"O artigo usa linguagem de grupo controle e grupo tratamento ao comparar quartis de distritos por proporção de moradores em favelas, o que poderia sugerir desenho causal; porém a análise não explicita uma estratégia de identificação como DiD, experimento, IV, RDD ou matching, e a modelagem principal é regressão observacional com claims explicativos."
S2236-57102024000100400,CONEXÕES ENTRE CAPACIDADES BUROCRÁTICAS E BUROCRACIAS DE MÉDIO ESCALÃO: UMA PESQUISA DE ESCOPO,Cadernos Gestão Pública e Cidadania,2024,317,mixed_empirical,descriptive_statistics_only,descriptive_quantitative_only,"A decisão central é tratar a scoping review como empírica e mista porque os autores constroem e analisam um corpus próprio de artigos, com síntese qualitativa e estatísticas descritivas. Contudo, trata-se de uma revisão de literatura, não de pesquisa empírica sobre burocratas, organizações ou políticas diretamente observadas."
S2236-57102024000100402,SEM VÍNCULO PERMANENTE - CONDIÇÕES DE TRABALHO DOS CONTRATADOS NA ADMINISTRAÇÃO PÚBLICA DOS ESTADOS BRASILEIROS,Cadernos Gestão Pública e Cidadania,2024,319,mixed_empirical,descriptive_statistics_only,descriptive_quantitative_only,"O artigo é majoritariamente documental e descritivo e afirma que não tem como objetivo estudar as causas do processo, mas também sustenta que as normas promovem precarização do trabalho. Por isso há uma reivindicação explicativa substantiva sobre efeitos/precarização, sem desenho causal ou inferência estatística."
S2236-57102024000100403,DECIFRANDO A ESFINGE DA BUROCRACIA SUBNACIONAL NO FEDERALISMO BRASILEIRO: O QUE SE ESCONDE POR TRÁS DESSA REALIDADE?,Cadernos Gestão Pública e Cidadania,2024,320,mixed_empirical,bivariate_tests_or_correlations_only,bivariate_or_correlation_screen,"A classificação como mixed_empirical depende de tratar a leitura e interpretação dos resumos filtrados como componente qualitativo substantivo; esse componente é real, mas secundário em relação à bibliometria e às estatísticas descritivas. A categoria bivariada também é uma decisão interpretativa porque as correlações são correlações de palavras, não testes substantivos entre variáveis políticas."
S2236-57102024000100405,TRANSPARÊNCIA SOBRE DIRIGENTES PÚBLICOS ESTADUAIS: UMA ANÁLISE EXPLORATÓRIA,Cadernos Gestão Pública e Cidadania,2024,321,mixed_empirical,descriptive_statistics_only,descriptive_quantitative_only,"O artigo contém linguagem sobre consequências da falta de transparência para democracia e políticas públicas, mas sua análise empírica própria é apenas exploratória e descritiva; por isso há claim explicativo geral, sem aplicação de tela de métodos de credibilidade."
S2236-57102024000100406,DESIGUALDADES DE GÊNERO E COR/RAÇA ENTRE OS DIRIGENTES MUNICIPAIS E ESTADUAIS NO BRASIL (2010 e 2019),Cadernos Gestão Pública e Cidadania,2024,322,quantitative_only,statistical_modeling,explicit_causal_design_screen,"O artigo usa CEM e linguagem de identificação de efeitos, o que sustenta registrar matching_or_weighting como método de credibilidade; porém a justificativa causal é limitada, com pareamento e regressões apresentados sobretudo como redução de viés observável, sem discussão detalhada de ignorabilidade ou desenho quase-experimental."
S2236-57102024000100408,LUIZ CARLOS BRESSER-PEREIRA: UM INTELECTUAL PÚBLICO NACIONALISTA DEMOCRÁTICO,Cadernos Gestão Pública e Cidadania,2024,323,qualitative_only,none,qualitative_only,"O artigo é ensaístico e não explicita método qualitativo formal; ainda assim, ele usa substantivamente evidência biográfica, documental e bibliográfica para reconstruir e interpretar a atuação de Bresser-Pereira, o que justifica classificá-lo como empírico qualitativo. As menções bibliométricas não são análise quantitativa original."
S2236-57102024000100418,INTEGRIDADE PÚBLICA: (DE)LIMITAÇÕES CONCEITUAIS E CAMINHOS PARA UMA AGENDA ROBUSTA,Cadernos Gestão Pública e Cidadania,2024,324,none,none,not_empirical,"O artigo descreve uma revisão de literatura por conveniência e síntese de padrões, o que poderia parecer análise qualitativa. Contudo, pelo esquema do prompt, revisões de literatura sem análise empírica original devem ser classificadas como não empíricas; aqui a revisão serve à delimitação conceitual e não a uma análise substantiva de evidência empírica."
S2236-57102024000100419,EM BUSCA DE UMA ÉTICA ADMINISTRATIVA PÓS-CONVENCIONAL NO CONTEXTO DAS ORGANIZAÇÕES PÚBLICAS BRASILEIRAS,Cadernos Gestão Pública e Cidadania,2024,325,none,none,not_empirical,"The article mentions pesquisa bibliográfica, prior empirical studies, and the authors' professional experience, and it says it seeks theoretical-empirical development. However, the body does not present original empirical evidence, a systematic qualitative analysis, or any quantitative reanalysis; it explicitly describes the work as an artigo teórico."
S2236-57102024000100420,Modelo de maturidade para avaliar a gestão de integridade nas contratações públicas,Cadernos Gestão Pública e Cidadania,2024,326,mixed_empirical,descriptive_statistics_only,descriptive_quantitative_only,"The authors describe the study as qualitative, but the Results section reports original descriptive quantitative classification of public integrity programs. The program count also appears as 184 in the Methodology and 187 in the Results. These issues affect evidence-type classification but not enough to obscure that the paper is mixed empirical with descriptive statistics only."
S2236-57102024000100421,"INTEGRIDADE, ÉTICA E COMBATE À CORRUPÇÃO NO CAMPO DA ADMINISTRAÇÃO PÚBLICA BRASILEIRA: DESAFIOS CONCEITUAIS E HORIZONTES POSSÍVEIS",Cadernos Gestão Pública e Cidadania,2024,327,none,none,not_empirical,"O artigo discute normas federais e trajetórias institucionais, o que poderia ser visto como análise documental qualitativa. Contudo, ele se define como ensaio conceitual e teórico, não apresenta método nem corpus documental sistemático, e usa as normas como apoio argumentativo; por isso foi classificado como não empírico."
S2236-57102024000100600,DESAFIOS PARA O ESTUDO COMPARADO DO FINANCIAMENTO DA SEGURANÇA PÚBLICA NOS ESTADOS,Cadernos Gestão Pública e Cidadania,2024,328,mixed_empirical,descriptive_statistics_only,descriptive_quantitative_only,"A principal ambiguidade é se o uso de organogramas e análise institucional deve contar como componente qualitativo empírico. Classifiquei como misto porque a seção de resultados usa essa evidência documental para interpretar diferenças de governança, embora o núcleo da evidência seja quantitativo descritivo."
S2236-57102024000100800,COMPLIANCE E ISOMORFISMO MIMÉTICO DA LEI ANTICORRUPÇÃO NOS ESTADOS BRASILEIROS,Cadernos Gestão Pública e Cidadania,2024,329,mixed_empirical,descriptive_statistics_only,descriptive_quantitative_only,"O artigo usa linguagem explicativa e uma proposição sobre isomorfismo mimético, além de contagens estaduais, mas a análise quantitativa é apenas descritiva e a inferência substantiva decorre principalmente de análise documental qualitativa, sem desenho causal formal."
S2236-57102025000100200,Formação da agenda governamental de enfrentamento à violência contra a mulher,Cadernos Gestão Pública e Cidadania,2025,331,qualitative_only,none,qualitative_only,"The article includes tables and descriptive administrative numbers from legislative and judicial sources, but these are embedded in a documentary reconstruction and are not presented as original quantitative analysis or statistical inference. The safest classification is qualitative only."
S2236-57102025000100201,Efeito do monitoramento dos observatórios sociais nos gastos municipais brasileiros,Cadernos Gestão Pública e Cidadania,2025,332,quantitative_only,statistical_modeling,explicit_causal_design_screen,"The paper contains institutional descriptions and quoted material about observatory practices, but these serve as context and mechanism discussion rather than a substantive qualitative empirical analysis. I therefore classify the empirical evidence as quantitative_only rather than mixed_empirical."
S2236-57102025000100202,Reforma do setor portuário brasileiro: Análise dos investimentos após a Lei n. 12.815/2013,Cadernos Gestão Pública e Cidadania,2025,333,mixed_empirical,descriptive_statistics_only,causal_claim_with_quantitative_analysis_screen,"The article is explicitly descriptive and has no causal identification design, but it also frames the analysis as investigating the effects and impact of the 2013 regulatory framework. I therefore screened it because the causal/explanatory claim is associated with quantitative descriptive analysis, while classifying the credibility-revolution method as absent."
S2236-57102025000100203,PORTAIS ELETRÔNICOS NA ACCOUNTABILITY: ABRINDO A &#8220;CAIXA-PRETA&#8221;,Cadernos Gestão Pública e Cidadania,2025,334,none,none,not_empirical,"O artigo tem procedimento sistemático de busca e síntese de 51 estudos, o que é uma forma de análise bibliográfica própria; contudo, pelo schema, revisões de literatura sem análise empírica original substantiva não devem ser classificadas como artigos empíricos."
S2236-57102025000100204,ADMINISTRAÇÃO PÚBLICA 4.0 E OS CONCURSOS PARA CARREIRAS DA ÁREA ECONÔMICA DO PODER EXECUTIVO FEDERAL,Cadernos Gestão Pública e Cidadania,2025,335,mixed_empirical,descriptive_statistics_only,descriptive_quantitative_only,"O artigo usa linguagem causal forte, como 'impacto da Administração Pública 4.0', mas a evidência apresentada é uma comparação documental descritiva entre editais antigos e recentes, sem desenho de identificação ou inferência estatística. Por isso há claim explicativo, mas não método de credibilidade."
S2236-57102025000100205,FIQUE EM CASA! O DESEMPENHO DOS TRABALHADORES DURANTE A PANDEMIA DO COVID-19,Cadernos Gestão Pública e Cidadania,2025,336,mixed_empirical,statistical_modeling,statistical_modeling_screen,"O artigo usa linguagem de impacto e modelagem estatística exploratória, mas não apresenta estratégia de identificação causal. Como a modelagem é observacional e sem desenho de credibilidade, foi classificado como causal/explanatory claim sem método de credibilidade."
S2236-57102025000100206,GESTÃO PARTICIPATIVA E AS INTERAÇÕES DOS CONSELHOS MUNICIPAIS COM OS MOVIMENTOS INSURGENTES EM CIDADES DO SEMIÁRIDO BRASILEIRO,Cadernos Gestão Pública e Cidadania,2025,337,qualitative_only,none,qualitative_only,"O texto informa contagens de movimentos, conselhos e cidades e remete a tabelas/figura, o que poderia sugerir descrição quantitativa mínima. Contudo, no corpo fornecido essas contagens funcionam como descrição do campo e da amostra; o próprio artigo declara usar pesquisa qualitativa e não apresenta análise estatística substantiva."
S2236-57102025000100207,CUSTOS NO SETOR PÚBLICO: O CUSTO DO ABSENTEÍSMO NAS UNIDADES BÁSICAS DE SAÚDE,Cadernos Gestão Pública e Cidadania,2025,338,mixed_empirical,descriptive_statistics_only,descriptive_quantitative_only,"O artigo faz algumas afirmações explicativas sobre desperdício, filas e relação entre oferta e absenteísmo, mas a análise própria é essencialmente descritiva e contábil; por isso não deve ser classificado como causal ou inferencial."
S2236-57102025000100209,A LUTA DE MULHERES PARA VIVEREM BEM JUNTAS! MOBILIZAÇÕES COLETIVAS E ASSOCIAÇÃO NA FRONTEIRA BRASIL-BOLÍVIA,Cadernos Gestão Pública e Cidadania,2025,339,mixed_empirical,descriptive_statistics_only,descriptive_quantitative_only,"O artigo se declara qualitativo e sua análise substantiva é interpretiva, mas apresenta contagens descritivas próprias das iniciativas mapeadas; por isso foi classificado como mixed_empirical e quantitative_analysis_type descriptive_statistics_only, sem inferência estatística."
S2236-57102025000100210,A EQUIDADE NA IMPLEMENTAÇÃO DE POLÍTICAS: UMA TEMÁTICA IMPLÍCITA E SUBTEORIZADA,Cadernos Gestão Pública e Cidadania,2025,340,mixed_empirical,descriptive_statistics_only,descriptive_quantitative_only,"O artigo é uma revisão sistemática de literatura, categoria que o prompt exclui quando não há análise empírica original. Aqui, porém, os autores constroem e analisam um corpus próprio de artigos com codificação indutiva e estatísticas descritivas, o que sustenta classificá-lo como empírico misto; a decisão exigiu separar revisão meramente narrativa de revisão sistemática com análise documental própria."
S2236-57102025000100211,SERVIÇOS PÚBLICOS E TECNOLOGIAS DIGITAIS: UMA ANÁLISE BIBLIOMÉTRICA,Cadernos Gestão Pública e Cidadania,2025,341,mixed_empirical,descriptive_statistics_only,descriptive_quantitative_only,"O artigo é uma revisão sistemática/bibliométrica, não uma pesquisa de campo sobre cidadãos ou governos. Ainda assim, apresenta análise quantitativa própria de dados bibliográficos e interpretação qualitativa dos clusters e temas, o que justifica classificá-lo como empírico misto, com análise quantitativa descritiva apenas."
S2236-57102025000100600,PROPOSIÇÃO DE INDICADORES PARA A CIDADE INTELIGENTE E CRIATIVA,Cadernos Gestão Pública e Cidadania,2025,343,mixed_empirical,descriptive_statistics_only,descriptive_quantitative_only,"O artigo se autodeclara qualitativo, mas a validação dos indicadores usa contagens e percentuais de concordância dos especialistas; por isso foi classificado como misto com análise quantitativa descritiva, sem inferência estatística."
S2236-57102025000100601,TECNOLOGIA SOCIAL PARA A GARANTIA DA SEGURANÇA ALIMENTAR NOS CENTROS URBANOS,Cadernos Gestão Pública e Cidadania,2025,344,qualitative_only,none,qualitative_only,"O artigo cita muitos números de relatórios oficiais e estudos anteriores, e a metodologia menciona avaliação de dados secundários. Contudo, o texto não mostra análise quantitativa original nem reanálise própria; por isso, a classificação quantitativa Torreblanca deve permanecer falsa."
S2236-57102025000100800,"BOA GOVERNANÇA, MODELOS DE GESTÃO E INGRESSO NO SERVIÇO PÚBLICO BRASILEIRO: ENTRE DISCURSOS E PRÁTICAS",Cadernos Gestão Pública e Cidadania,2025,345,mixed_empirical,descriptive_statistics_only,descriptive_quantitative_only,"A classificação quantitativa é uma decisão difícil porque o corpo textual fornecido menciona a Tabela 1 e discute indicadores oficiais, mas não reproduz a tabela. A seção, contudo, deixa claro que dados oficiais foram usados para sustentar uma análise descritiva das modalidades de ingresso, sem inferência estatística."
S2236-57102025000100801,VIOLAÇÕES DE DIREITOS HUMANOS PELA FUNDAÇÃO RENOVA: FRAGMENTAÇÃO DE PROCESSOS E POLÍTICAS EXCLUDENTES,Cadernos Gestão Pública e Cidadania,2025,346,mixed_empirical,descriptive_statistics_only,descriptive_quantitative_only,"O artigo se autodeclara qualitativo e exploratório, mas também calcula percentuais de violações a partir do material analisado. Esses percentuais são análise quantitativa original, porém apenas descritiva, sem testes, incerteza ou modelagem."
S2236-57102025000100803,"MUDANÇAS SOCIAIS, INSTRUMENTOS DIGITAIS DE AÇÃO PÚBLICA E REENGENHARIA SOCIOTÉCNICA DO ESTADO",Cadernos Gestão Pública e Cidadania,2025,348,quantitative_only,descriptive_statistics_only,descriptive_quantitative_only,"O artigo é explicitamente um ensaio e quase todo o texto é conceitual e normativo. Ainda assim, a seção sobre infraestrutura apresenta figuras e contagens usadas como evidência descritiva própria ou reanalisada, o que justifica uma classificação quantitativa descritiva limitada, sem inferência."
S2236-57102025000101003,COCRIAÇÃO E PARTICIPAÇÃO SOCIAL: ANÁLISE DOS SEIS PLANOS DE AÇÃO DA PARCERIA PARA O GOVERNO ABERTO NO BRASIL (2011-2023),Cadernos Gestão Pública e Cidadania,2025,352,mixed_empirical,descriptive_statistics_only,descriptive_quantitative_only,"A introdução declara abordagem qualitativa, mas o corpo do artigo apresenta contagens, percentuais e tabelas comparativas próprias sobre compromissos e atores. Por isso, a classificação mais adequada é mixed_empirical com análise quantitativa descritiva apenas."
S2236-57102025000101004,"TRANSPARÊNCIA ATIVA, DADOS ABERTOS E DESEMPENHO ACADÊMICO: ANÁLISE DAS UNIVERSIDADES FEDERAIS BRASILEIRAS",Cadernos Gestão Pública e Cidadania,2025,353,quantitative_only,statistical_modeling,statistical_modeling_screen,"O artigo usa linguagem de efeito e relações causais e estima regressões OLS, mas também se autodefine como pesquisa descritiva quantitativa e não apresenta estratégia de identificação causal; por isso deve ser triado, mas não classificado como método de credibilidade-revolução."
S2236-57102025000101005,AVALIAÇÃO DE SISTEMAS DE GOVERNO ABERTO E DE TRANSPARÊNCIA PÚBLICA NAS CAPITAIS BRASILEIRAS,Cadernos Gestão Pública e Cidadania,2025,354,mixed_empirical,descriptive_statistics_only,descriptive_quantitative_only,"A metodologia usa a expressão estratégia experimental e a conclusão emprega linguagem de impacto, mas o desenho apresentado é uma inspeção avaliativa e descritiva de portais, sem tratamento, controle, randomização ou identificação causal. Também há um componente qualitativo de observações de casos específicos, embora o peso principal da evidência esteja em estatísticas descritivas."
S2236-57102025000101007,TRANSPARÊNCIA NO MINISTÉRIO PÚBLICO DO ESTADO DO PARÁ: CONTORNOS E AVANÇOS NA GARANTIA DE DIREITOS,Cadernos Gestão Pública e Cidadania,2025,355,mixed_empirical,descriptive_statistics_only,descriptive_quantitative_only,"A metodologia se declara qualitativa, mas o artigo usa rankings e percentuais de atendimento do Transparentômetro como evidência empírica própria ou reanalisada. A decisão foi classificá-lo como mixed_empirical e quantitativo descritivo, sem inferência estatística."
S2236-57102025000101200,CAPACIDADES DE INOVAÇÃO NO EMPREENDEDORISMO SOCIAL EM AMBIENTE DE CRISE: UMA ANÁLISE PELA PERSPECTIVA DOS COLABORADORES,Cadernos Gestão Pública e Cidadania,2025,358,mixed_empirical,statistical_modeling,statistical_modeling_screen,"A análise textual com Iramuteq quantifica o corpus e usa AFC, CHD, análise de similitude e chi2, o que justifica classificação quantitativa ampla e modelagem textual; ao mesmo tempo, o desenho substantivo é predominantemente qualitativo e interpretativo, sem estratégia causal de identificação."
S2236-57102025000101400,ARRANJOS INSTITUCIONAIS PARA O DESENVOLVIMENTO DE COMUNIDADES SUSTENTÁVEIS: UMA ANÁLISE SOBRE A IMPLEMENTAÇÃO DO PROTOCOLO COMUNITÁRIO DO BAILIQUE,Cadernos Gestão Pública e Cidadania,2025,363,qualitative_only,none,qualitative_only,"O artigo apresenta várias contagens próprias de entrevistas e trechos codificados, mas elas funcionam como descrição do corpus qualitativo e não como análise quantitativa substantiva; por isso a classificação quantitativa foi mantida como none."
S2236-57102025000101401,BIOECONOMIA NA AMAZÔNIA: EVIDÊNCIAS DA FÁBRICA FILHA DO COMBU NA ORQUESTRAÇÃO DE EMPREENDIMENTOS SOBRE A FLORESTA EM PÉ,Cadernos Gestão Pública e Cidadania,2025,364,mixed_empirical,descriptive_statistics_only,descriptive_quantitative_only,"O artigo se autodeclara qualitativo, mas inclui análise própria de planilhas e tabelas de quantidades faturadas e frutos utilizados. Isso torna a classificação mais adequada como mixed_empirical com quantitativo descritivo, embora sem inferência estatística ou modelagem."
S2236-57102025000101402,DETERMINANTES DO DESMATAMENTO HISTÓRICO E RECENTE DA AMAZÔNIA NA PERSPECTIVA DA ESTATÍSTICA ESPACIAL,Cadernos Gestão Pública e Cidadania,2025,365,quantitative_only,statistical_modeling,statistical_modeling_screen,"O artigo usa linguagem de determinantes, impacto e fatores que contribuem para o desmatamento, mas a estratégia empírica é regressão espacial observacional sem discussão de identificação causal; por isso passa pelo screen, mas não recebe método de credibilidade-revolution."
