pid,title,journal_title,year,eligible_order,empirical_evidence_type,quantitative_analysis_type,credibility_revolution_screen_reason,tough_call_reason
S1981-38212015000100093,The 2014 Elections and the Brazilian Party System,Brazilian Political Science Review,2015,89,mixed_empirical,descriptive_statistics_only,descriptive_quantitative_only,"The article is clearly quantitative under the broad Torreblanca rule because it organizes and compares electoral indicators, but it is also heavily qualitative and explanatory. The key judgment is that its quantitative component remains descriptive only, since the text itself says it does not rigorously test some hypotheses and contains no statistical inference or modeling."
S1981-38212015000100135,The Impacts of Conditional Cash Transfers in Four Presidential Elections (2002&#8211;2014),Brazilian Political Science Review,2015,90,quantitative_only,statistical_modeling,statistical_modeling_screen,"The paper uses matching and generalized propensity score methods and explicitly frames estimates as BFP effects, supporting a credibility-revolution matching classification. However, it also acknowledges that Brazil lacks randomized pilots or sharp discontinuities and that the 2014 indirect-effect explanation is not directly tested, so causal attribution is qualified."
S1981-38212015000200003,"State Transfers, Taxes and Income Inequality in Brazil",Brazilian Political Science Review,2015,91,quantitative_only,statistical_modeling,statistical_modeling_screen,"The article uses counterfactual wage decomposition, selection models, and explanatory language about the State's contribution to inequality, but it explicitly lacks random assignment and does not provide a design-based causal identification strategy; therefore it is screened but not classified as using a credibility-revolution method."
S1981-38212015000200054,Corruption and Political Participation in the Americas and the Caribbean,Brazilian Political Science Review,2015,93,quantitative_only,statistical_modeling,statistical_modeling_screen,"The article uses explanatory and effect language and argues that experience with corruption may indicate a relationship rather than a mere association, but the empirical strategy is observational logistic regression with controls, interactions, and country fixed effects, without an explicit credibility-revolution identification design or identification assumptions."
S1981-38212015000200081,Does the Electoral Rule Matter for Political Polarization? The Case of Brazilian Legislative Chambers,Brazilian Political Science Review,2015,94,quantitative_only,statistical_modeling,statistical_modeling_screen,"The article uses explicit treatment/control and identification language, but the empirical strategy is an observational comparison using WNOMINATE ideal points and t-tests, with acknowledged selection issues and no listed credibility-revolution design or explicit modern causal identification method."
S1981-38212015000300003,Impact of Electronic Voting Machines on Blank Votes and Null Votes in Brazilian Elections in 1998,Brazilian Political Science Review,2015,95,mixed_empirical,statistical_modeling,explicit_causal_design_screen,"The article explicitly uses difference-in-differences as a causal design, but presents the results as average percentage-point differences without regression output or uncertainty estimates. I therefore classify it as statistical modeling for the quantitative-analysis type because of the explicit DiD design, while coding statistical inference as absent."
S1981-38212015000300042,The Capital Mistake: Local Information and National Electoral Reforms,Brazilian Political Science Review,2015,96,mixed_empirical,statistical_modeling,statistical_modeling_screen,"The article uses causal and explanatory language and includes fixed effects and robustness checks, but the empirical strategy is observational regression without a clearly articulated credibility-revolution identification design. I therefore screen it because it uses statistical modeling, but classify the credibility-revolution method as absent."
S1981-38212015000300064,Reversing Polarities: Anarchical (Failed) States versus International Progress,Brazilian Political Science Review,2015,97,qualitative_only,none,qualitative_only,"The article is not empirical in a positivist sense and has no explicit corpus or coding procedure, but the prompt treats discourse analysis and documents as qualitative empirical evidence, and the article's own method is close textual analysis of a body of literature."
S1981-38212015000300088,Assessing some measures of online deliberation,Brazilian Political Science Review,2015,98,none,none,not_empirical,"The article repeatedly discusses empirical methods and briefly mentions the author's own empirical work, but it does not present the empirical analysis itself. The central judgment is to distinguish methodological review from original empirical evidence."
S1981-38212015000300116,Enlarging the Playing Field: Political Circulation of Brazilian Senators in the First Republic,Brazilian Political Science Review,2015,99,mixed_empirical,bivariate_tests_or_correlations_only,bivariate_or_correlation_screen,"The paper clearly contains original quantitative analysis, but the boundary between descriptive statistics only and bivariate tests is somewhat ambiguous because the body text reports standardized residuals and significant residuals without showing the underlying test details. I classify it as bivariate because standardized residuals are used analytically to assess association between periods and career categories."
S1981-38212016000100201,Modernization Without Change: Decision-Making Process in the Mercosur Parliament,Brazilian Political Science Review,2016,100,mixed_empirical,statistical_modeling,statistical_modeling_screen,"The Banzhaf index is a deterministic game-theoretic voting-power calculation rather than conventional regression or inferential statistics. It goes beyond descriptive statistics, so it is classified under statistical_modeling as the closest available schema category, but it is not statistical inference or a credibility-revolution causal method."
S1981-38212016000100202,Elite Framing of Inequality in the Press: Brazil and Uruguay Compared,Brazilian Political Science Review,2016,101,mixed_empirical,bivariate_tests_or_correlations_only,bivariate_or_correlation_screen,"Most substantive quantitative analysis is descriptive content-analysis evidence, but the Coding section reports Cohen's Kappa with a p-value for original coding reliability; therefore the article is coded as bivariate_tests_or_correlations_only rather than descriptive_statistics_only."
S1981-38212016000100203,Emerging Powers and the Notion of International Responsibility: moral duty or shifting goalpost?,Brazilian Political Science Review,2016,102,qualitative_only,none,qualitative_only,"The article is heavily conceptual, but it also contains a substantive qualitative case discussion of Brazil's diplomatic engagement with intervention norms. I classify it as empirical qualitative because that case analysis uses policy documents and diplomatic debates as evidence rather than serving only as abstract theory."
S1981-38212016000100205,"U.S. International Agricultural Trade Policy: Interests, Institutions and Information in the Corn Supply Chain",Brazilian Political Science Review,2016,104,mixed_empirical,descriptive_statistics_only,descriptive_quantitative_only,"The article includes many numbers and contribution/vote counts, and these appear to be part of the authors' empirical reconstruction rather than merely background statistics. However, all quantitative use is descriptive, with no statistical tests or modeling, while the core explanatory evidence remains qualitative."
S1981-38212016000100206,The Stratification of Diversity: Measuring the Hierarchy of Brazilian Political Science,Brazilian Political Science Review,2016,105,mixed_empirical,descriptive_statistics_only,descriptive_quantitative_only,"The article combines interpretive content coding with quantitative descriptive indicators. It makes explanatory claims about stratification, but the quantitative analysis is limited to constructed indices, percentages, rankings, and descriptive comparisons without statistical inference or design-based causal identification."
S1981-38212016000100207,Japanese International Relations: an assessment of the 1971-2011 period,Brazilian Political Science Review,2016,106,qualitative_only,none,qualitative_only,"The article repeatedly mentions empirical data and includes contextual quantitative indicators from cited sources, but it does not present its own or reanalyzed quantitative analysis; therefore these references do not satisfy the quantitative classification rule."
S1981-38212016000200203,Brazilian Political Institutions: an Inconclusive Debate,Brazilian Political Science Review,2016,109,none,none,not_empirical,"The article makes many explanatory claims and discusses empirical studies by other authors, but it does not present original empirical evidence or reanalysis. The classification therefore treats it as non-empirical despite its substantive engagement with empirical literature."
S1981-38212016000200204,Does Size Matter? Electoral Performance of Small Parties in Brazil,Brazilian Political Science Review,2016,110,quantitative_only,statistical_modeling,statistical_modeling_screen,"The article repeatedly uses effect language and statistical tests, but it does not articulate a design-based causal identification strategy. Cluster analysis and observational comparisons justify `statistical_modeling`, while the credibility-revolution method should not be counted as present."
S1981-38212016000200206,Unboxing the Active Role of the Legislative Power in Brazil,Brazilian Political Science Review,2016,112,mixed_empirical,bivariate_tests_or_correlations_only,bivariate_or_correlation_screen,"The main judgment concerns empirical evidence type: the article's results are predominantly quantitative summaries of coded provisions, but the coding itself depends on substantive legal-document analysis of bills, amendments, substitute bills, and vetoes. I classify it as mixed empirical because that documentary coding is integral to the empirical evidence, while noting that the reported analysis is mostly quantitative."
S1981-38212016000300201,Oversized Government Coalitions in Latin America,Brazilian Political Science Review,2016,114,quantitative_only,statistical_modeling,statistical_modeling_screen,"The paper uses explanatory language and panel-style observational models with temporal controls, lags, fixed effects, mixed effects, and clustered standard errors, but it does not articulate a design-based identification strategy. Therefore it should be screened but not counted as a credibility-revolution method."
S1981-38212016000300203,"Personality, Political Attitudes and Participation in Protests: The Direct and Mediated Effects of Psychological Factors on Political Activism",Brazilian Political Science Review,2016,116,quantitative_only,statistical_modeling,statistical_modeling_screen,"The paper repeatedly uses causal and mediation language, but the empirical strategy is observational regression-based mediation without an explicit design-based identification strategy or assumptions such as randomization, ignorability, DiD, IV, RDD, or matching. It should therefore be screened but not coded as a credibility-revolution method."
S1981-38212016000300204,Corporate Dependence in Brazil's 2010 Elections for Federal Deputy,Brazilian Political Science Review,2016,117,quantitative_only,statistical_modeling,statistical_modeling_screen,"The article has explanatory hypotheses and a multivariate model, so it should be screened, but it does not articulate a design-based causal identification strategy; the proper classification is observational regression with causal/explanatory claims but no credibility-revolution method."
S1981-38212016000300206,Foreign aid and the governance of international financial organizations: the Brazilian-bloc case in the IMF and the World Bank,Brazilian Political Science Review,2016,119,quantitative_only,statistical_modeling,statistical_modeling_screen,"The article uses causal language such as impact and influence and interprets OLS coefficients as effects, but the empirical design is observational cross-sectional regression with controls and no explicit design-based identification strategy. Therefore it is screened but not counted as a credibility-revolution method."
S1981-38212017000100201,"National Intelligence Systems as Networks: Power Distribution and Organizational Risk in Brazil, Russia, India, China, and South Africa",Brazilian Political Science Review,2017,121,mixed_empirical,statistical_modeling,statistical_modeling_screen,"The quantitative analysis consists of network construction and centrality or centralization metrics rather than regression or inferential modeling. Because the schema treats network models as statistical modeling and the article analytically models intelligence systems as networks, it is classified as statistical_modeling, with no statistical inference and no credibility-revolution causal design."
S1981-38212017000100203,Germany and Greece in the Eurozone Crisis from the Viewpoint of the Neo-Neo Debate,Brazilian Political Science Review,2017,123,mixed_empirical,descriptive_statistics_only,descriptive_quantitative_only,"The article is heavily theoretical and literature-based, but it also contains the authors' own descriptive comparisons of Eurostat indicators in figures and text. I therefore classify it as mixed empirical with descriptive quantitative analysis, not as a purely theoretical essay and not as inferential quantitative work."
S1981-38212017000100204,"Business, Government and Foreign Policy: Brazilian Construction Firms Abroad",Brazilian Political Science Review,2017,124,mixed_empirical,descriptive_statistics_only,descriptive_quantitative_only,"The article self-describes as qualitative, but the main empirical section also reports descriptive graphs, figures, tables, and database cross-referencing produced or reanalyzed by the authors. These support a broad Torreblanca quantitative classification, but only as descriptive statistics, not statistical modeling or inference."
S1981-38212017000100401,The Genesis of Participatory Democracy in Brazil: a Scientific (Re)Construction,Brazilian Political Science Review,2017,125,none,none,not_empirical,"The article presents historical examples and interpretive evidence from prior studies, especially about participation under the military regime, but it identifies itself as a review essay and does not present an original empirical research design, dataset, fieldwork, archive, or systematic qualitative analysis. I therefore classify it as non-empirical for this schema, while noting that it contains substantive historical discussion."
S1981-38212017000200201,Leaders or Loners? How Do the BRICS Countries and their Regions Vote in the UN General Assembly,Brazilian Political Science Review,2017,126,quantitative_only,bivariate_tests_or_correlations_only,bivariate_or_correlation_screen,"The article uses causal/explanatory language such as whether regional-power status generates cohesion, but the empirical strategy is ANOVA and affinity comparisons without a design-based causal identification strategy. The country-background sections are substantive but are literature-based framing rather than original qualitative evidence."
S1981-38212017000200204,Coalition Presidentialism in Bicameral Congresses: How does the Control of a Bicameral Majority Affect Coalition Survival?,Brazilian Political Science Review,2017,129,quantitative_only,statistical_modeling,causal_claim_with_quantitative_analysis_screen,"The central classification ambiguity is that mvQCA is a formal configurational, set-theoretic method rather than conventional statistical modeling. Because the article uses coded variables, truth tables, necessity and sufficiency tests, minimization, formulas, coverage, and software-based analysis to test hypotheses, it is classified as quantitative analysis beyond descriptive statistics, with no statistical inference and no credibility-revolution identification design."
S1981-38212017000200205,"Accountability, Corruption and Local Government: Mapping the Control Steps",Brazilian Political Science Review,2017,130,mixed_empirical,statistical_modeling,statistical_modeling_screen,"The Lottery Program randomly selects municipalities and the article uses explanatory language, logistic regressions, and survival analysis, but the random audit selection is not used as a causal identification design and no credibility-revolution method or identification assumption is presented."
S1981-38212017000200206,Taxonomy of interstate conflicts: is South America a peaceful region?,Brazilian Political Science Review,2017,131,mixed_empirical,descriptive_statistics_only,descriptive_quantitative_only,"The article explicitly says it used content analysis of datasets and presents descriptive counts from conflict databases, so it counts as quantitative under the broad Torreblanca rule; however, the main contribution is interpretive and classificatory, and the phrase 'evidence of correlation' is not backed by a reported statistical correlation test or model in the body text."
S1981-38212017000300201,The Solidarity Economy in South and North America: Converging Experiences,Brazilian Political Science Review,2017,133,qualitative_only,none,qualitative_only,"The article includes many descriptive statistics from previous mappings and reports, but these are cited as secondary evidence rather than analyzed as the article's own quantitative data. Under the anti-false-positive rule, this should not count as original quantitative analysis."
S1981-38212017000300202,Politics on the Web: Using Twitter to Estimate the Ideological Positions of Brazilian Representatives,Brazilian Political Science Review,2017,134,quantitative_only,statistical_modeling,statistical_modeling_screen,"The article contains explanatory interpretations of why PT and PSDB are distant in Twitter networks and uses Bayesian statistical modeling, but the empirical design is a measurement/validation exercise rather than a causal identification design. The qualitative contextual discussion also does not amount to a standalone qualitative empirical component."
S1981-38212018000100200,Expert-Driven and Citational Approaches to Assessing Journal Publications of Brazilian Political Scientists,Brazilian Political Science Review,2018,137,quantitative_only,statistical_modeling,statistical_modeling_screen,"The article uses explanatory language about factors influencing Qualis scores and ordered logistic regressions, but it provides no design-based causal identification strategy; therefore it is screened for credibility-revolution methods but classified as observational regression with causal or explanatory claims and no credibility-revolution design."
S1981-38212018000100203,Coproduce or Codevelop Military Aircraft? Analysis of Models Applicable to USAN,Brazilian Political Science Review,2018,140,mixed_empirical,descriptive_statistics_only,descriptive_quantitative_only,"The article is primarily qualitative, but the body discusses multiple descriptive tables and counts based on external data sources. I classify it as mixed empirical because those descriptive quantitative analyses are used substantively in the USAN comparison, while keeping the quantitative type as descriptive_statistics_only."
S1981-38212018000200200,Strategic Coalitions and Agenda-Setting in Fragmented Congresses: How the PRI Sets the Legislative Agenda in Mexico,Brazilian Political Science Review,2018,143,mixed_empirical,statistical_modeling,statistical_modeling_screen,"The article uses Probit regressions and modeled ideal points, so it is statistical modeling, but it does not clearly report conventional statistical inference in the body. It also makes explanatory claims from observational case-study evidence without a credibility-revolution identification design."
S1981-38212018000200201,"Representation, Epistemic Democracy, and Political Parties in John Stuart Mill and José de Alencar",Brazilian Political Science Review,2018,144,none,none,not_empirical,"The article performs close textual interpretation of primary texts, which could be seen as qualitative evidence in a broad humanities sense. For this classification schema, however, it is best treated as political theory/conceptual interpretation rather than an empirical qualitative social-scientific article."
S1981-38212018000200203,Freedom through form: Bolívar Lamounier and the Liberal Interpretation of Brazilian Political Thought*,Brazilian Political Science Review,2018,146,qualitative_only,none,qualitative_only,"The article is not empirical in the quantitative social-science sense, but the schema counts substantive qualitative evidence such as documents, interpretive analysis, and intellectual-history materials. Because the article closely analyzes published texts as evidence, it is classified as qualitative empirical rather than non-empirical theory."
S1981-38212018000300201,Between Autonomy and Dependency: the Place of Agency in Brazilian Foreign Policy,Brazilian Political Science Review,2018,150,qualitative_only,none,qualitative_only,"The article is partly a conceptual essay and literature-based intellectual history rather than a conventional empirical study. I classify it as qualitative empirical because it substantively analyzes historical foreign-policy episodes, diplomatic discourse, and prior conceptual texts rather than remaining purely normative or formal."
S1981-38212018000300204,Entries and Withdrawals: Electoral Coordination across Different Offices and the Brazilian Party Systems,Brazilian Political Science Review,2018,153,mixed_empirical,descriptive_statistics_only,descriptive_quantitative_only,"The article includes counterfactual seat simulations and explicit explanatory claims, but the quantitative evidence is descriptive/simulation-based and correlational rather than inferential or design-based; the authors themselves say causal inference methods are needed for causal direction."
S1981-38212018000300205,Do Concepts Matter? Latin America and South America in the Discourse of Brazilian Foreign Policymakers,Brazilian Political Science Review,2018,154,mixed_empirical,descriptive_statistics_only,descriptive_quantitative_only,"The article combines historical-literature reconstruction with original quantitative content analysis. I classify it as mixed empirical because the body uses substantive historical qualitative material to develop and interpret expectations, but the original empirical contribution is primarily descriptive quantitative frequency analysis."
S1981-38212019000100201,Football UN-ited: From the Game of War to the War of the Game,Brazilian Political Science Review,2019,155,qualitative_only,none,qualitative_only,"The article is essayistic and theoretical, with no explicit empirical method, but it does substantively reconstruct and interpret historical documents, institutional episodes, and comparative cases. I therefore classify it as qualitative empirical rather than purely conceptual."
S1981-38212019000100203,"Political Institutions and the Legislative Success of Brazilian Presidents: an Analysis of the Cardoso, Lula and Rousseff Governments",Brazilian Political Science Review,2019,157,quantitative_only,statistical_modeling,statistical_modeling_screen,"The article uses explanatory language and logistic regression, but it provides no design-based causal identification strategy. I therefore classify it as statistical modeling with observational causal/explanatory claims, not as a credibility-revolution method."
S1981-38212019000100204,"Capital Mobility, Veto Players, and Redistribution in Latin America During the Left Turn",Brazilian Political Science Review,2019,158,quantitative_only,statistical_modeling,statistical_modeling_screen,"The article makes causal and explanatory claims and uses TSCS regression with random/fixed effects and robust standard errors, but it does not articulate a design-based identification strategy. Therefore it should be screened because it uses statistical modeling, but the credibility-revolution method is absent and best coded as observational regression with a causal claim but no design."
S1981-38212019000100205,Juvenile Sentencing: A Mixed-Methods Approach,Brazilian Political Science Review,2019,159,mixed_empirical,statistical_modeling,statistical_modeling_screen,"The article repeatedly frames the design as contributing to causal inference and mechanism explanation, but its own quantitative model is observational regression and explicitly disclaims causal identification. Therefore it should be screened because it uses statistical modeling and explanatory claims, but no credibility-revolution method is present."
S1981-38212019000200200,Social Forces and the International Political Economy after the 2008 Financial Crisis: The Case of Business Summit 20 (B20),Brazilian Political Science Review,2019,161,mixed_empirical,descriptive_statistics_only,descriptive_quantitative_only,"The article uses causal-mechanism, process-tracing and hoop-test language, but it explicitly frames the analysis as exploratory document/content analysis and descriptive comparison, without statistical inference or a design-based causal identification strategy."
