pid,title,journal_title,year,eligible_order,empirical_evidence_type,quantitative_analysis_type,credibility_revolution_screen_reason,tough_call_reason
S1981-38212007000100053,Tradition and Diversification in the Uses and Definitions of the Law: A Proposed Analysis,Brazilian Political Science Review,2007,3,none,none,not_empirical,"The body text references Table 1 and Table 2 and mentions an analysis of authors involved in curriculum reform, which creates some ambiguity. Because the provided text does not include table contents or report a systematic original empirical procedure, these references are treated as illustrative support within a conceptual framework rather than as original empirical analysis."
S1981-38212007000100102,Career Choice and Legislative Reelection: Evidence from Brazil and Colombia,Brazilian Political Science Review,2007,4,mixed_empirical,statistical_modeling,statistical_modeling_screen,"The article has strong explanatory language and statistical modeling, but it relies on observational random-effects probit regressions and interaction comparisons without a design-based identification strategy, so it should not be counted as a credibility-revolution method."
S1981-38212007000200074,Women and Candidate Quality in the Elections for the Senate: Brazil and the United States in Comparative Perspective,Brazilian Political Science Review,2007,6,quantitative_only,statistical_modeling,statistical_modeling_screen,"The article uses explanatory language and statistical models, but it does not present a design-based causal identification strategy. The appropriate credibility-revolution coding is therefore observational regression with causal or explanatory claims but no credibility-revolution method."
S1981-38212007000200108,Rethinking State Politics: The Withering of State Dominant Machines in Brazil,Brazilian Political Science Review,2007,7,mixed_empirical,statistical_modeling,statistical_modeling_screen,"The paper combines typological qualitative comparison with quantitative factor analysis and correlations. Its causal explanation is substantive, but the article itself notes that the Bolsa Família evidence rests on simple correlations, so it should be screened but not counted as a credibility-revolution design."
S1981-38212008000100010,Personal Networks and Urban Poverty: Preliminary Findings,Brazilian Political Science Review,2008,9,mixed_empirical,statistical_modeling,statistical_modeling_screen,"The quantitative classification is clear because the article uses K-means clustering analytically, but the causal screening is a judgment call because the article uses explanatory language about determinants and impact while presenting preliminary observational and typological analysis without an identification design."
S1981-38212008000100057,Brazilian Democracy and the Power of &#8220;Old&#8221; Theories of Party Competition,Brazilian Political Science Review,2008,11,mixed_empirical,bivariate_tests_or_correlations_only,bivariate_or_correlation_screen,"The article is written as an essay using established theories rather than as a conventional methods-driven empirical article. The quantitative classification rests on the author's tables, graphs, percentages, indexes, and especially reported correlations; the qualitative classification rests on case-based historical and policy interpretation rather than interviews, archives, or formal qualitative methods."
S1981-38212008000100096,Re-evaluating the Contribution and Legacy of Hedley Bull,Brazilian Political Science Review,2008,13,none,none,not_empirical,"The article performs sustained textual interpretation of theoretical works, which could superficially resemble qualitative text analysis. However, the stated purpose and execution are conceptual exegesis and critical theory discussion, and the prompt excludes conceptual essays and literature reviews without original empirical analysis from empirical classification."
S1981-38212008000200010,The Role of the Brazilian Congress in Foreign Policy: An Empirical Contribution to the Debate,Brazilian Political Science Review,2008,14,mixed_empirical,descriptive_statistics_only,descriptive_quantitative_only,"The article makes explanatory institutional claims and uses descriptive quantitative indicators, but it does not use statistical tests, modeling, or a design-based causal identification strategy. I therefore classify the quantitative component as descriptive only and do not treat it as a credibility-revolution screen case."
S1981-38212008000200039,"Development, Good Governance, and Local Democracy",Brazilian Political Science Review,2008,15,none,none,not_empirical,"The paper closely interprets policy documents and development discourse, which could resemble qualitative document analysis, but it does not present an explicit empirical design, corpus, method, or original systematic qualitative analysis. I therefore classify it as a conceptual/theoretical critical essay rather than an empirical qualitative paper."
S1981-38212008000200074,Policy Positions in the Chilean Senate: An Analysis of Coauthorship and Roll Call Data,Brazilian Political Science Review,2008,16,quantitative_only,statistical_modeling,statistical_modeling_screen,"The article contains explanatory language and uses statistical modeling, but the models are spatial-scaling and network-position analyses rather than causal identification designs; therefore it passes the screen but has no credibility-revolution method."
S1981-38212008000200093,"Justice, Professionalism, and Politics in the Exercise of Judicial Review by Brazil's Supreme Court",Brazilian Political Science Review,2008,17,mixed_empirical,statistical_modeling,statistical_modeling_screen,"The article uses logistic regression and explanatory language about factors influencing decisions, but it does not articulate a design-based causal identification strategy. I therefore screen it for credibility-revolution methods but classify the method as observational regression with causal or explanatory claims and no credibility-revolution design."
S1981-38212009000100093,How Safe are &#8220;Safe&#8221; Seats? A Comparison of Voluntary and Compulsory Voting Systems,Brazilian Political Science Review,2009,21,none,none,not_empirical,"The article uses probability analysis, equations, standard deviations, and hypothetical numerical examples, which are quantitative in a formal mathematical sense. However, the classifier requires original or reanalyzed empirical quantitative data analysis, and the article does not analyze observed data."
S1981-38212009000200011,Politics and Development: Lessons from Latin America,Brazilian Political Science Review,2009,23,qualitative_only,none,qualitative_only,"The article includes several descriptive numbers and cited survey percentages, especially from the Parliamentary Elites in Latin America survey, but these are used as secondary contextual evidence rather than as the authors' original or reanalyzed quantitative analysis."
S1981-38212009000200030,"Strong Presidents, Robust Democracies? Separation of Powers and Rule of Law in Latin America",Brazilian Political Science Review,2009,24,mixed_empirical,descriptive_statistics_only,descriptive_quantitative_only,"The article describes itself as conceptual and exploratory and relies heavily on literature synthesis, but it also presents and interprets comparative descriptive indicators and country cases as empirical evidence. I therefore classify it as mixed empirical with descriptive quantitative analysis only, not as purely theoretical or as inferential quantitative research."
S1981-38212009000200060,At What Point does a Legislature Become Institutionalized? the Mercosur Parliament's Path,Brazilian Political Science Review,2009,25,mixed_empirical,descriptive_statistics_only,descriptive_quantitative_only,"The article is primarily qualitative, but it also presents original descriptive counts and averages of Parlasur activity, especially normative acts and attendance patterns. These descriptive quantitative summaries justify coding it as mixed empirical and Torreblanca-style quantitative, but only as descriptive_statistics_only."
S1981-38212009000200127,"Political Parties, Foreign Policy and Ideology: Argentina and Chile in Comparative Perspective",Brazilian Political Science Review,2009,27,mixed_empirical,statistical_modeling,statistical_modeling_screen,"The article uses statistical modeling through NOMINATE and makes explanatory claims about party ideology, so it must be screened, but it does not use a design-based causal identification strategy or report inferential uncertainty in the body text provided. It also has a qualitative component based on plenary stenographical notes, but the provided body summarizes that component rather than reproducing detailed qualitative evidence."
S1981-38212010000100010,"Electoral Success and Political Institutionalization in the Federal Deputy Elections in Brazil (1998, 2002 and 2006)",Brazilian Political Science Review,2010,28,quantitative_only,statistical_modeling,statistical_modeling_screen,"The article repeatedly uses language of variables affecting or increasing chances of electoral success, and it estimates logistic regressions, but it does not articulate a design-based identification strategy; therefore this is screened but coded as observational regression with causal/explanatory claims and no credibility-revolution design."
S1981-38212010000100033,Judicialization of Health Policy in the Definition of Access to Public Goods: Individual Rights versus Collective Rights,Brazilian Political Science Review,2010,29,mixed_empirical,descriptive_statistics_only,causal_claim_with_quantitative_analysis_screen,"The article's quantitative analysis is purely descriptive, but it uses those descriptive findings to support explanatory claims about judicial interference and distributional effects. I therefore screened it for credibility-revolution methods while classifying no such method as present."
S1981-38212010000200010,"Federalism, Bicameralism, and Institutional Change: General Trends and One Case-study",Brazilian Political Science Review,2010,32,mixed_empirical,descriptive_statistics_only,descriptive_quantitative_only,"The article combines descriptive quantitative analysis with a qualitative case-study explanation. Its causal language could be mistaken for causal inference, but the empirical strategy is descriptive comparison and roll-call analysis without statistical inference or a design-based causal identification strategy."
S1981-38212010000200078,The Decreasing Political Rewards of Education in Brazil,Brazilian Political Science Review,2010,35,quantitative_only,statistical_modeling,statistical_modeling_screen,"The article foregrounds descriptive time-series graphs in this article, but it also explicitly reports correlations, logistic regressions, inferential tests, and multivariate statistical tests. It therefore goes beyond descriptive statistics, while still lacking a design-based causal identification strategy."
S1981-38212011000100011,How Innovative Was the Poupatempo Experience in Brazil? Institutional Bypass as a New Form of Institutional Change,Brazilian Political Science Review,2011,37,qualitative_only,none,qualitative_only,"The article reports many administrative figures, budgets, costs, survey percentages, and satisfaction numbers, but these are used as contextual or cited descriptive evidence rather than as original or reanalyzed quantitative analysis by the authors."
S1981-38212011000100054,Brazilian Parties According to their Manifestos: Political Identity and Programmatic Emphases,Brazilian Political Science Review,2011,39,mixed_empirical,bivariate_tests_or_correlations_only,bivariate_or_correlation_screen,"The main ambiguity is whether to code the quantitative analysis as descriptive only or bivariate/inferential. Because the article reports an association test, residual analysis under a null hypothesis of independence, and a statistically significant Cohen's kappa reliability test, it goes beyond descriptive statistics, but it does not use multivariable statistical modeling."
S1981-38212011000100077,Euroskepticism in European National Elections: The Rise of Voter Support for New Radical Right Parties,Brazilian Political Science Review,2011,40,quantitative_only,statistical_modeling,statistical_modeling_screen,"The article uses fixed-effects panel models and explanatory language about the impact of representation on ERP support, but it does not present treatment timing, treated/control comparisons, parallel-trends logic, or another explicit design-based identification strategy. Therefore it is screened but not classified as having a credibility-revolution method."
S1981-38212011000200010,Judiciary-Executive relations in Policy Making: the Case of Drug Distribution in the State of São Paulo,Brazilian Political Science Review,2011,42,qualitative_only,none,qualitative_only,"The article includes several numerical facts from administrative sources and prior studies, but these are contextual or secondary figures rather than the authors' own systematic quantitative analysis."
S1981-38212011000200039,Independence after Delegation? Presidential Calculus and Political Interference in Brazilian Regulatory Agencies,Brazilian Political Science Review,2011,43,mixed_empirical,statistical_modeling,statistical_modeling_screen,"The article makes explanatory claims and uses random-effects panel regression, but it also describes the analysis as exploratory and does not articulate a design-based causal identification strategy; therefore it should be screened but not coded as using a credibility-revolution method."
S1981-38212011000200094,Federalism and Public Resources in Brazil: Federal Discretionary Transfers to States,Brazilian Political Science Review,2011,45,quantitative_only,statistical_modeling,statistical_modeling_screen,"The paper uses institutional and legal background and explanatory language, but its original empirical analysis is quantitative regression. I classify it as quantitative_only because the institutional discussion is contextual rather than a qualitative empirical design; I classify the causal-method field as observational regression without a credibility design because the authors explicitly disclaim causal identification."
S1981-38212012000100011,"Democracy, Redistribution, and Equality",Brazilian Political Science Review,2012,47,mixed_empirical,descriptive_statistics_only,descriptive_quantitative_only,"The article uses quantitative income-distribution data and mentions statistical non-difference by regime, but its own analysis is mostly descriptive and synthetic, while statistical modeling is cited from other work rather than presented as an original article-level method."
S1981-38212012000100053,Empirical Determinants of Government Efficiency: A Study Based on Objective Indicators,Brazilian Political Science Review,2012,49,quantitative_only,statistical_modeling,statistical_modeling_screen,"The Endogeneity issues section mentions instruments and Hausman tests, but the text presents them as diagnostics for possible endogeneity in observational regressions rather than as a full instrumental-variables causal identification design estimating treatment effects. Therefore the article passes the screen but is coded as observational regression with causal or explanatory claims and no credibility-revolution design."
S1981-38212012000100070,Trust and Political Information: Attitudinal Change in Participants in the Youth Parliament in Brazil,Brazilian Political Science Review,2012,50,quantitative_only,statistical_modeling,explicit_causal_design_screen,"The article explicitly invokes quasi-experimental logic and difference in difference, but the body text also states that the data do not allow a direct causal test of whether political information caused increased confidence. This creates ambiguity for the mechanism claim, though not for the presence of a difference-in-difference-style causal design for program effects."
S1981-38212012000100090,Women in Motion: Female Representation in the Rio Grande do Sul State Legislative Assembly,Brazilian Political Science Review,2012,51,mixed_empirical,descriptive_statistics_only,descriptive_quantitative_only,"The article is clearly descriptive quantitative, but mixed_empirical is a judgment call because the qualitative component is mostly historical-contextual and theoretical rather than a systematic qualitative research design. The newspaper and cultural-historical evidence are nevertheless substantive enough to count as qualitative evidence."
S1981-38212012000100113,Electoral Governance in Brazil,Brazilian Political Science Review,2012,52,mixed_empirical,descriptive_statistics_only,descriptive_quantitative_only,"The article contains descriptive quantitative figures and references to a graph and table, but these are ancillary to a qualitative legal-institutional argument and do not go beyond descriptive statistics."
S1981-38212012000200001,"Liberalism, Marxism and Democratic Theory Revisited: Proposal of a Joint Index of Political and Economic Democracy",Brazilian Political Science Review,2012,53,quantitative_only,descriptive_statistics_only,descriptive_quantitative_only,"The paper is mainly theoretical and methodological, but Table 1 applies a newly constructed index to real country-level data. That empirical application is enough for quantitative empirical classification, while the theoretical and historical sections are not systematic qualitative empirical analysis."
S1981-38212012000200002,"The Bigger, the Better: Coalitions in the GATT/WTO",Brazilian Political Science Review,2012,54,mixed_empirical,statistical_modeling,statistical_modeling_screen,"The article uses causal language and within-case mechanism analysis, but its quantitative analysis is observational Bayesian modeling without a design-based identification strategy; therefore it passes the screen but does not contain a credibility-revolution method."
S1981-38212012000200003,Political Competition and the Diffusion of Conditional Cash Transfers in Brazil,Brazilian Political Science Review,2012,55,mixed_empirical,statistical_modeling,statistical_modeling_screen,"The qualitative component is present but less systematically documented than the quantitative models, and the article uses causal language with Cox and logit models but does not provide a design-based causal identification strategy. I therefore classify it as mixed empirical with observational regression-style causal claims, not as a credibility-revolution method."
S1981-38212012000200004,What is the Best Strategy to Obtain Legislative Support?: Survey Evidence from Brazilian State Assemblies,Brazilian Political Science Review,2012,56,quantitative_only,statistical_modeling,statistical_modeling_screen,"The article uses explanatory and effect language with multinomial logit, controls, state fixed effects, bootstrap, and confidence intervals, but it does not articulate a design-based causal identification strategy. Therefore it passes the statistical-modeling screen but should not be counted as a credibility-revolution method."
S1981-38212013000100004,Human security paradigms and economic crisis in first year of the North Caucasus Federal District,Brazilian Political Science Review,2013,59,qualitative_only,none,qualitative_only,"The article cites and compares many descriptive numerical indicators, especially violence, unemployment, poverty, GDP, and subsidy figures, but these are used as secondary contextual evidence rather than as an original quantitative analysis or systematic reanalysis."
S1981-38212013000200005,Internet and politics studies in Brazil: mapping the characteristics and disparities of the research field,Brazilian Political Science Review,2013,65,mixed_empirical,descriptive_statistics_only,descriptive_quantitative_only,"The article's own evidence is presented mainly as descriptive quantitative coding of conference papers, but the coding process required qualitative document reading and classification. I classify it as mixed empirical because the paper uses document/content classification as empirical evidence while reporting the results primarily through descriptive statistics."
S1981-38212013000300002,The institutionalization of Brazilian political thought in the social sciences: wanderley guilherme dos santos' research revisited (1963-1978),Brazilian Political Science Review,2013,67,qualitative_only,none,qualitative_only,"The main ambiguity is whether an intellectual-history essay based on close reading of texts should count as empirical. Under this schema, the article's sustained documentary and interpretive analysis of primary and secondary texts supports classification as qualitative empirical, even though it has no formal methods section or dataset."
S1981-38212013000300005,Foreign policy change in Brazil: comparing Castelo Branco (1964-1967) and Fernando Collor (1990-1992),Brazilian Political Science Review,2013,70,qualitative_only,none,qualitative_only,"The article includes many descriptive numerical indicators, but they are contextual figures drawn from cited sources and not an original or clearly reanalyzed quantitative analysis; therefore they do not meet the prompt's threshold for a quantitative empirical paper."
S1981-38212013000300007,Diffusion of good government: social sector reforms in Brazil,Brazilian Political Science Review,2013,72,none,none,not_empirical,"The article repeatedly describes the reviewed book's survival analysis, regressions, process tracing, interviews, and causal explanations. These are not the review article's own empirical analyses, so they should not be counted for classification."
S1981-38212014000100002,"A study on the impact of campaign finance, political capital and gender on electoral performance",Brazilian Political Science Review,2014,74,quantitative_only,statistical_modeling,statistical_modeling_screen,"The article repeatedly uses impact and effect language, but the empirical strategy is observational logistic regression with controls and interactions, without an explicit design-based causal identification strategy. Therefore it is screened but not classified as using a credibility-revolution method."
S1981-38212014000200008,"Cooperation for Development, Brazilian Regional Leadership and Global Protagonism",Brazilian Political Science Review,2014,78,qualitative_only,none,qualitative_only,"The article contains many descriptive figures and references to tables, but the body text presents them as documentary and secondary descriptive evidence supporting a qualitative case argument rather than as original or reanalyzed quantitative data analysis with a distinct analytic procedure."
S1981-38212014000200070,Flying in Clear Skies: Technical Arguments Influencing ANAC Regulations,Brazilian Political Science Review,2014,81,mixed_empirical,statistical_modeling,statistical_modeling_screen,"The article uses content analysis of public-hearing comments and regulatory documents, which is qualitative material, but the substantive empirical presentation is mainly quantitative coding and regression. I classify it as mixed because the authors explicitly conduct content analysis of comment contents to generate the empirical variables, while recognizing that the core analysis is statistical."
S1981-38212014000200094,A Comparative Analysis of Brazil's Foreign Policy Drivers Towards the USA: Comment on Amorim Neto (2011),Brazilian Political Science Review,2014,82,quantitative_only,statistical_modeling,statistical_modeling_screen,"The article uses causal and explanatory language with panel statistical models and model diagnostics, but it does not articulate a design-based identification strategy. Therefore it is screened for credibility-revolution methods but classified as observational regression with causal claim and no credibility-revolution design."
S1981-38212014000300003,The Three Achilles' Heels of Brazilian Political Science,Brazilian Political Science Review,2014,83,mixed_empirical,descriptive_statistics_only,descriptive_quantitative_only,"The article combines descriptive quantitative indicators with historical-institutional interpretation. The quantitative component is clearly original descriptive analysis, while the qualitative component is mainly documentary and reconstructive rather than interview- or ethnography-based; this makes mixed_empirical a judgment call, but the body supports it."
S1981-38212014000300098,Beyond Brazilian Coalition Presidentialism: the Appropriation of the Legislative Agenda,Brazilian Political Science Review,2014,86,mixed_empirical,statistical_modeling,statistical_modeling_screen,"The article uses fuzzy-set QCA, a configurational set-theoretic method with coded variables and solution algorithms. It is clearly original quantitative/configurational analysis beyond descriptive statistics, but it is not a conventional statistical model and does not report conventional statistical inference or a credibility-revolution identification design."
S1981-38212015000100039,The Institutional Presidency from a Comparative Perspective: Argentina and Brazil since the 1980s,Brazilian Political Science Review,2015,87,mixed_empirical,statistical_modeling,statistical_modeling_screen,"The paper makes explanatory claims and uses statistical modeling, but it does not articulate a design-based causal identification strategy. The appropriate credibility classification is therefore observational regression with causal or explanatory claims but no credibility-revolution method."
