pid,title,journal_title,journal_area,year,period_3,credibility_revolution_screen_applicable,credibility_revolution_method_present,method_type,causal_design_quote,tough_call,method_class
S0104-62762015000300574,Ideologia e comportamento político no eleitorado brasileiro,Opinião Pública,Ciência Política,2015,2012-2018,TRUE,FALSE,observational_regression_with_causal_claim_no_design,NA,FALSE,diagnostic_not_design
S0104-62762015000300626,Privação relativa e ativismo em protestos no Brasil: uma investigação sobre o horizonte do possível,Opinião Pública,Ciência Política,2015,2012-2018,TRUE,FALSE,observational_regression_with_causal_claim_no_design,Os resultados empíricos deste artigo foram gerados a partir de métodos estatísticos descritivos e multivariados [...] a técnica de análise multivariada escolhida foi a de regressão logística.,TRUE,diagnostic_not_design
S0104-62762015000300643,Aferindo a capacidade de influência das conferências de políticas públicas sobre os programas das respectivas políticas setoriais,Opinião Pública,Ciência Política,2015,2012-2018,TRUE,FALSE,none_detected,NA,TRUE,diagnostic_not_design
S0104-62762015000300673,Federalismo e bons governos: uma análise política da gestão fiscal dos municípios,Opinião Pública,Ciência Política,2015,2012-2018,TRUE,FALSE,observational_regression_with_causal_claim_no_design,Na busca de evidências empíricas que permitissem testar se variáveis políticas afetam o equilíbrio fiscal dos municípios [...] foram elaborados dois modelos de regressão linear múltipla,TRUE,diagnostic_not_design
S0104-62762015000300693,Política partidária e meio ambiente: a adesão dos partidos políticos brasileiros à agenda verde,Opinião Pública,Ciência Política,2015,2012-2018,TRUE,FALSE,none_detected,NA,TRUE,diagnostic_not_design
S0104-62762016000100001,"Federalismo, coalizões de governo e escolhas de carreira dos deputados federais",Opinião Pública,Ciência Política,2016,2012-2018,TRUE,FALSE,observational_regression_with_causal_claim_no_design,"Para avaliar de forma mais rigorosa o impacto das coalizões governativas nacional e estadual sobre as estratégias de carreira dos parlamentares, recorremos a um modelo logístico multinomial.",TRUE,diagnostic_not_design
S0104-62762016000100028,Estruturas de poder nas redes de financiamento político nas eleições de 2010 no Brasil,Opinião Pública,Ciência Política,2016,2012-2018,TRUE,FALSE,none_detected,NA,TRUE,diagnostic_not_design
S0104-62762016000100056,"O custo da política subnacional: a forma como o dinheiro é gasto importa? Relação entre receita, despesas e sucesso eleitoral",Opinião Pública,Ciência Política,2016,2012-2018,TRUE,FALSE,observational_regression_with_causal_claim_no_design,utilizamos técnicas de regressão logística multivariada para testar o impacto dos tipos de despesa no sucesso eleitoral dos candidatos.,TRUE,diagnostic_not_design
S0104-62762016000100093,"Boa noite, e boa sorte: determinantes da demissão de ministros envolvidos em escândalos de corrupção no primeiro governo Dilma Rousseff",Opinião Pública,Ciência Política,2016,2012-2018,TRUE,FALSE,observational_regression_with_causal_claim_no_design,O objetivo da análise estatística consiste em estimar um modelo probabilístico da relação causal entre as variáveis explicativas e a probabilidade de o ministro denunciado deixar o ministério.,TRUE,diagnostic_not_design
S0104-62762016000100118,A redução da maioridade penal diminui a violência? Evidências de um estudo comparado,Opinião Pública,Ciência Política,2016,2012-2018,TRUE,FALSE,observational_regression_with_causal_claim_no_design,"O aumento de um ano na maioridade penal está associado à redução de 0,365 na taxa de homicídio, controlando pelas demais variáveis.",TRUE,diagnostic_not_design
S0104-62762016000100167,Sistemas deliberativos em perspectiva meso: a abordagem dos subsistemas aplicada aos conselhos de políticas públicas em Belo Horizonte,Opinião Pública,Ciência Política,2016,2012-2018,TRUE,FALSE,none_detected,NA,TRUE,diagnostic_not_design
S0104-62762016000100195,Efeitos de enquadramento em política externa: evidência empírica de países emergentes e a rivalidade argentino-brasileira,Opinião Pública,Ciência Política,2016,2012-2018,TRUE,TRUE,experiment_survey,Participants were randomly assigned to one of the two experimental treatments or to the control group.,FALSE,strict_design_method
S0104-62762016000200250,Efetividade da participação nos conselhos municipais de assistência social do Brasil,Opinião Pública,Ciência Política,2016,2012-2018,TRUE,FALSE,none_detected,NA,TRUE,diagnostic_not_design
S0104-62762016000200286,Análise espacial da burocracia da assistência social nos municípios brasileiros: notas para uma reflexão sobre a capacidade de implementação dessa política,Opinião Pública,Ciência Política,2016,2012-2018,TRUE,FALSE,none_detected,NA,TRUE,diagnostic_not_design
S0104-62762016000200418,Racionalidade online: provimento de razões em discussões virtuais,Opinião Pública,Ciência Política,2016,2012-2018,TRUE,FALSE,observational_regression_with_causal_claim_no_design,A estratégia de pesquisa envolve [...] um modelo de regressão logística; não há discussão textual de identificação causal.,TRUE,diagnostic_not_design
S0104-62762016000200446,Discussões em torno do referendo sobre o comércio de armas de fogo e munição na Folha de S. Paulo,Opinião Pública,Ciência Política,2016,2012-2018,TRUE,FALSE,none_detected,NA,TRUE,diagnostic_not_design
S0104-62762016000200466,A lógica social do voto correto no Brasil,Opinião Pública,Ciência Política,2016,2012-2018,TRUE,FALSE,observational_regression_with_causal_claim_no_design,O modelo probit [...] foi o método utilizado para analisar as chances de ocorrência do voto correto a partir das variáveis independentes dessa amostra.,TRUE,diagnostic_not_design
S0104-62762016000300492,"Cultura política, mudanças econômicas e democracia inercial. Uma análise pós-eleições de 2014",Opinião Pública,Ciência Política,2016,2012-2018,TRUE,FALSE,none_detected,NA,TRUE,diagnostic_not_design
S0104-62762016000300524,Os determinantes da avaliação da economia na eleição presidencial brasileira em 2014,Opinião Pública,Ciência Política,2016,2012-2018,TRUE,FALSE,observational_regression_with_causal_claim_no_design,"Ao testarmos no modelo a afetividade partidária, foi possível verificar como as condições afetivas se sobrepõem às condições cognitivas na avaliação da econômica.",TRUE,diagnostic_not_design
S0104-62762016000300550,Vencedores e perdedores nas eleições presidenciais de 2014: o efeito da derrota nas urnas sobre a satisfação e o apoio em relação à democracia no Brasil,Opinião Pública,Ciência Política,2016,2012-2018,TRUE,FALSE,observational_regression_with_causal_claim_no_design,Com todo o cuidado que a limitação de uma pesquisa com corte transversal impõe,TRUE,diagnostic_not_design
S0104-62762016000300569,Identificação partidária e voto. As diferenças entre petistas e peessedebistas,Opinião Pública,Ciência Política,2016,2012-2018,TRUE,FALSE,observational_regression_with_causal_claim_no_design,"Para responder a essa questão, usamos as variáveis de controle definidas acima para nosso exercício de regressão logística.",TRUE,diagnostic_not_design
S0104-62762016000300603,Sentimentos partidários e antipetismo: condicionantes e covariantes,Opinião Pública,Ciência Política,2016,2012-2018,TRUE,FALSE,observational_regression_with_causal_claim_no_design,A Tabela 9 apresenta os resultados de análise de regressão multinomial probit em que a variável dependente é o voto para presidente no 1º turno em 2014.,TRUE,diagnostic_not_design
S0104-62762016000300638,O eleitor antipetista: partidarismo e avaliação retrospectiva,Opinião Pública,Ciência Política,2016,2012-2018,TRUE,TRUE,instrumental_variables,"""Optamos por ajustar um modelo em dois estágios em função da relação de endogeneidade identificada para algumas das variáveis no modelo""",TRUE,strict_design_method
S0104-62762016000300675,Como os brasileiros escolhem os governadores? Desvendando as razões do voto para os executivos estaduais no Brasil em 2014,Opinião Pública,Ciência Política,2016,2012-2018,TRUE,FALSE,observational_regression_with_causal_claim_no_design,O modelo 5 apresenta também um controle por efeitos fixos nos estados.,TRUE,diagnostic_not_design
S0104-62762016000300702,Lutas simbólicas na arena midiática: o poder de agência do Ministério Público e as controvérsias sobre a PEC 37,Opinião Pública,Ciência Política,2016,2012-2018,TRUE,FALSE,none_detected,NA,TRUE,diagnostic_not_design
S0104-62762017000100001,Variedades da Democracia no Brasil,Opinião Pública,Ciência Política,2017,2012-2018,TRUE,FALSE,none_detected,NA,TRUE,diagnostic_not_design
S0104-62762017000100043,Participação na democracia brasileira: a hegemonia popular e a inovação do protesto da classe média,Opinião Pública,Ciência Política,2017,2012-2018,TRUE,FALSE,none_detected,NA,TRUE,diagnostic_not_design
S0104-62762017000100060,O comportamento eleitoral dos paulistas e dos brasileiros nas eleições de 2002 e 2014,Opinião Pública,Ciência Política,2017,2012-2018,TRUE,FALSE,observational_regression_with_causal_claim_no_design,aplicamos o modelo de regressão logística binária sobre duas variáveis dependentes,TRUE,diagnostic_not_design
S0104-62762017000100096,O Partido dos Trabalhadores na Câmara dos Deputados: a evolução das bases socioeconômicas e territoriais (1994-2014),Opinião Pública,Ciência Política,2017,2012-2018,TRUE,FALSE,fixed_effects_causal_panel_claim,"Elaboramos modelos de mínimos quadrados generalizados com efeitos fixos, que controlam a heterogeneidade das variáveis não observadas no modelo que são constantes ao longo do tempo.",TRUE,diagnostic_not_design
S0104-62762017000100168,A disputa nos governos estaduais (1994-2014): a batalha entre incumbents e oposição,Opinião Pública,Ciência Política,2017,2012-2018,TRUE,FALSE,none_detected,"“Assim, são realizadas somente análises descritivas de dados.”",TRUE,diagnostic_not_design
S0104-62762017000100194,Para onde ir? A trajetória eleitoral dos prefeitos das capitais estaduais brasileiras (1996-2014),Opinião Pública,Ciência Política,2017,2012-2018,TRUE,FALSE,none_detected,NA,TRUE,diagnostic_not_design
S0104-62762017000100230,O direito ao aborto no debate legislativo brasileiro: a ofensiva conservadora na Câmara dos Deputados,Opinião Pública,Ciência Política,2017,2012-2018,TRUE,FALSE,none_detected,NA,TRUE,diagnostic_not_design
S0104-62762017000200289,O efeito da experiência democrática na estrutura da legitimidade na América Latina e no Caribe,Opinião Pública,Ciência Política,2017,2012-2018,TRUE,FALSE,observational_regression_with_causal_claim_no_design,Aplicamos un análisis factorial y un modelo multinivel de regresión multivariada; el número de años de democracia ininterrumpida impacta de manera positiva.,TRUE,diagnostic_not_design
S0104-62762017000200316,Os democratas insatisfeitos são críticos? Reavaliando o conceito de cidadão crítico,Opinião Pública,Ciência Política,2017,2012-2018,TRUE,FALSE,observational_regression_with_causal_claim_no_design,"The focus of our analysis, however, is the effect of each type of citizen on the participation and rejection of military coups.",TRUE,diagnostic_not_design
S0104-62762017000200334,Explicações assimétricas para a desconfiança em partidos políticos no Brasil,Opinião Pública,Ciência Política,2017,2012-2018,TRUE,FALSE,observational_regression_with_causal_claim_no_design,Ainda que esse método não seja capaz de identificar causalidade entre as variáveis dependente e independente,TRUE,diagnostic_not_design
S0104-62762017000200397,Nas malhas da justiça: uma análise dos dados oficiais de indiciados por drogas em Belo Horizonte (2008-2015),Opinião Pública,Ciência Política,2017,2012-2018,TRUE,FALSE,observational_regression_with_causal_claim_no_design,"Para testar essa hipótese, optamos por um modelo de regressão linear.",TRUE,diagnostic_not_design
S0104-62762017000200429,Mecanismos de alinhamento de preferências em governos multipartidários: controle de políticas públicas no presidencialismo brasileiro,Opinião Pública,Ciência Política,2017,2012-2018,TRUE,FALSE,observational_regression_with_causal_claim_no_design,Embora esses resultados não devam ser interpretados de forma causal,TRUE,diagnostic_not_design
S0104-62762017000200459,Debate político-eleitoral no Facebook: os comentários do público em posts jornalísticos na eleição presidencial de 2014,Opinião Pública,Ciência Política,2017,2012-2018,TRUE,FALSE,none_detected,NA,TRUE,diagnostic_not_design
S0104-62762017000200509,O empoderamento do Parlamento Europeu no controle da Comissão Europeia: os casos Santer (1995-1999) e Barroso (2004-2009),Opinião Pública,Ciência Política,2017,2012-2018,TRUE,FALSE,none_detected,NA,TRUE,diagnostic_not_design
S0104-62762017000300538,Facilitadores institucionais e sociais para a governança dos riscos ambientais à escala local. Análise de municípios chilenos,Opinião Pública,Ciência Política,2017,2012-2018,TRUE,FALSE,observational_regression_with_causal_claim_no_design,El análisis cuantitativo [...] incluye [...] el diseño de modelos de regresión.,TRUE,diagnostic_not_design
S0104-62762017000300580,Inclusão política? Recrutamento e seleção de atores nas conferências de políticas públicas,Opinião Pública,Ciência Política,2017,2012-2018,TRUE,FALSE,none_detected,NA,TRUE,diagnostic_not_design
S0104-62762017000300612,A quem servem as conferências de políticas públicas? Desenho institucional e atores beneficiados,Opinião Pública,Ciência Política,2017,2012-2018,TRUE,FALSE,none_detected,NA,TRUE,diagnostic_not_design
S0104-62762017000300682,"Mesmas instituições, mesmos resultados? Comparando o efeito da competição eleitoral sobre os níveis de concentração de votos",Opinião Pública,Ciência Política,2017,2012-2018,TRUE,TRUE,other_modern_causal_method,O quase experimento se constrói pela consideração do posto ao qual um determinado indivíduo decide concorrer.,TRUE,other_modern_causal_method
S0104-62762017000300714,A eficácia do pork barrel: a importância de emendas orçamentárias e prefeitos aliados na eleição de deputados,Opinião Pública,Ciência Política,2017,2012-2018,TRUE,TRUE,regression_discontinuity,"Próximo à descontinuidade há uma atribuição aleatória do tratamento, que permite testar seu efeito com grau razoável de validade interna — método conhecido como regressão descontínua (RD).",FALSE,strict_design_method
S0104-62762017000300714,A eficácia do pork barrel: a importância de emendas orçamentárias e prefeitos aliados na eleição de deputados,Opinião Pública,Ciência Política,2017,2012-2018,TRUE,TRUE,fixed_effects_causal_panel_claim,"Próximo à descontinuidade há uma atribuição aleatória do tratamento, que permite testar seu efeito com grau razoável de validade interna — método conhecido como regressão descontínua (RD).",FALSE,diagnostic_not_design
S0104-62762017000300754,"Relação entre propaganda, dinheiro e avaliação de governo no desempenho de candidatos em eleições majoritárias no Brasil",Opinião Pública,Ciência Política,2017,2012-2018,TRUE,FALSE,observational_regression_with_causal_claim_no_design,“Como não pretendemos usar o modelo de regressão para predições [...] Focamos a atenção nas estatísticas descritivas”,TRUE,diagnostic_not_design
S0104-62762017000300786,A categorização e a validação das respostas abertas em surveys políticos,Opinião Pública,Ciência Política,2017,2012-2018,TRUE,FALSE,none_detected,NA,FALSE,diagnostic_not_design
S0104-62762017000300809,O dinheiro importa menos para os candidatos evangélicos?,Opinião Pública,Ciência Política,2017,2012-2018,TRUE,FALSE,observational_regression_with_causal_claim_no_design,"Com o objetivo de mensurar esse efeito entre as despesas de campanha e o sucesso eleitoral obtido pelos candidatos, utilizamos o seguinte modelo de regressão logística",TRUE,diagnostic_not_design
S0104-62762018000100053,"Do lulismo ao antipetismo? Polarização, partidarismo e voto nas eleições presidenciais brasileiras",Opinião Pública,Ciência Política,2018,2012-2018,TRUE,FALSE,observational_regression_with_causal_claim_no_design,"A variável dependente foi dividida em quatro categorias [...] Estimamos modelos multinomiais logit para as eleições de 2002, 2006, 2010 e 2014.",FALSE,diagnostic_not_design
S0104-62762018000100090,Razão e emoção: reações ao estado da economia e aprovação do governo federal,Opinião Pública,Ciência Política,2018,2012-2018,TRUE,FALSE,observational_regression_with_causal_claim_no_design,A Tabela 6 apresenta os resultados de modelos de regressão logit que pretendem identificar as variáveis mais importantes dessa mudança de opinião.,TRUE,diagnostic_not_design
S0104-62762018000100114,Cascatas de notícias sobre corrupção: explicando viés midiático nos escândalos brasileiros,Opinião Pública,Ciência Política,2018,2012-2018,TRUE,FALSE,none_detected,NA,TRUE,diagnostic_not_design
S0104-62762018000100178,Mulheres com carreiras políticas longevas no legislativo brasileiro (1950-2014),Opinião Pública,Ciência Política,2018,2012-2018,TRUE,FALSE,none_detected,NA,TRUE,diagnostic_not_design
S0104-62762018000200270,"PT, eleições e editoriais da grande imprensa (1989-2014)",Opinião Pública,Ciência Política,2018,2012-2018,TRUE,FALSE,none_detected,NA,TRUE,diagnostic_not_design
S0104-62762018000200328,"Respondem os políticos a questionamentos dos eleitores? Um experimento controlando os incentivos de mensagem, período e meio",Opinião Pública,Ciência Política,2018,2012-2018,TRUE,TRUE,experiment_field,"Para descobrir as respostas a essas questões, realizamos um experimento, dividido em quatro rodadas, ao longo de um ano e meio de aplicações.",FALSE,strict_design_method
S0104-62762018000200365,Confiança nas instituições políticas: diferenças e interdependência nas opiniões de jovens e população brasileira,Opinião Pública,Ciência Política,2018,2012-2018,TRUE,FALSE,observational_regression_with_causal_claim_no_design,Obviamente é difícil apontar causalidade nessa relação.,TRUE,diagnostic_not_design
S0104-62762018000200405,"Congruência programática no Cone Sul. Argentina, Chile e Uruguai em perspectiva comparada",Opinião Pública,Ciência Política,2018,2012-2018,TRUE,FALSE,observational_regression_with_causal_claim_no_design,"Para explicar las variaciones de la congruencia programática, hemos construido modelos estadísticos lineales multivariados utilizando la medida many-to-one.",FALSE,diagnostic_not_design
S0104-62762018000200427,Há uma solução única para tudo? Uma análise da alocação dos ministérios no presidencialismo multipartidário brasileiro,Opinião Pública,Ciência Política,2018,2012-2018,TRUE,FALSE,observational_regression_with_causal_claim_no_design,NA,TRUE,diagnostic_not_design
S0104-62762018000200456,Aonde chega o Judiciário? Uma avaliação da expansão da Justiça do Trabalho no Brasil (2003-2010),Opinião Pública,Ciência Política,2018,2012-2018,TRUE,FALSE,observational_regression_with_causal_claim_no_design,O objetivo deste artigo foi mensurar os efeitos de fatores socioeconômicos na criação das varas judiciais por meio de um desenho Large-N.,TRUE,diagnostic_not_design
S0104-62762018000300596,Inframunicipalismo e clientelismo. Abordagens ao fenômeno a partir de suas práticas associadas,Opinião Pública,Ciência Política,2018,2012-2018,TRUE,FALSE,observational_regression_with_causal_claim_no_design,La variable independiente principal en los tres modelos es el tamaño del hábitat; recurrimos a tres modelos de regresión logística,FALSE,diagnostic_not_design
S0104-62762018000300622,"Dispersão decisória, centralidade política e entropia burocrática: mitigando custos transacionais na gestão públic",Opinião Pública,Ciência Política,2018,2012-2018,TRUE,FALSE,observational_regression_with_causal_claim_no_design,O modelo capta como cada variável independente contribui para a ocorrência de resultados com pelo menos 80% do previsto nos casos.,TRUE,diagnostic_not_design
S0104-62762018000300670,A volatilidade eleitoral nos municípios brasileiros para o cargo de vereador (2000-2016),Opinião Pública,Ciência Política,2018,2012-2018,TRUE,FALSE,observational_regression_with_causal_claim_no_design,"O principal método utilizado foi a regressão linear múltipla, que permite analisar o efeito de cada variável, ou grupo de variáveis, dentro de modelos específicos.",FALSE,diagnostic_not_design
S0104-62762019000100001,"Candidaturas laranja, cotas e manobras institucionais nas eleições legislativas brasileira",Opinião Pública,Ciência Política,2019,2019-2025,TRUE,FALSE,observational_regression_with_causal_claim_no_design,we estimate a logistic regression that evaluates the effect of those characteristics on a candidate’s probability of being a laranja,TRUE,diagnostic_not_design
S0104-62762019000100029,"Ideologia, sofisticação política e voto no Brasil",Opinião Pública,Ciência Política,2019,2019-2025,TRUE,FALSE,observational_regression_with_causal_claim_no_design,As estimativas geradas pelo modelo não têm uma interpretação causal.,TRUE,diagnostic_not_design
S0104-62762019000100063,Os protestos no Brasil em tempos de crise (2011-2016),Opinião Pública,Ciência Política,2019,2019-2025,TRUE,FALSE,none_detected,NA,TRUE,diagnostic_not_design
S0104-62762019000100169,"Sociedade civil, partidos políticos e inter-relações: um estudo comparativo entre Porto Alegre e Montevidéu",Opinião Pública,Ciência Política,2019,2019-2025,TRUE,FALSE,none_detected,NA,TRUE,diagnostic_not_design
S0104-62762019000100199,&#8216;Time after Time&#8217;: força das organizações partidárias em democracias novas e antigas,Opinião Pública,Ciência Política,2019,2019-2025,TRUE,FALSE,observational_regression_with_causal_claim_no_design,"The variables analyzed so far were included in OLS regression models with party membership, party income, and party strength as dependent variables.",TRUE,diagnostic_not_design
S0104-62762019000200234,"Educação, riqueza das nações e tolerância política aos homossexuais: uma análise multinível de 26 países das Américas",Opinião Pública,Ciência Política,2019,2019-2025,TRUE,FALSE,observational_regression_with_causal_claim_no_design,"The authors state, Given that we do not explicitly show this causal link, while relying on observational OLS and multilevel regressions.",FALSE,diagnostic_not_design
S0104-62762019000200258,Opinião e cenários comunicativos: influência de fatores contextuais nos processos sociopsicológicos da espiral do silêncio,Opinião Pública,Ciência Política,2019,2019-2025,TRUE,FALSE,observational_regression_with_causal_claim_no_design,Os dados para a realização deste artigo foram obtidos a partir da aplicação de questionários on-line. O método de composição da amostra foi não probabilístico e por adesão voluntária.,TRUE,diagnostic_not_design
S0104-62762019000200287,"Percepções de violência e capital social em Nuevo León, México",Opinião Pública,Ciência Política,2019,2019-2025,TRUE,FALSE,observational_regression_with_causal_claim_no_design,Para evitar el problema de la endogeneidad o causalidad inversa... no se emplearon directamente los índices... sino un promedio de cada conglomerado del muestreo.,TRUE,diagnostic_not_design
S0104-62762019000200312,"Efeitos de competição, gastos de campanha e fragmentação eleitoral sobre comparecimento e votos válidos nas eleições municipais brasileiras em 2012",Opinião Pública,Ciência Política,2019,2019-2025,TRUE,FALSE,observational_regression_with_causal_claim_no_design,Utilizo modelos multivariados de regressão linear simples para explicar os níveis de comparecimento eleitoral e votos válidos agregados ao nível municipal.,TRUE,diagnostic_not_design
S0104-62762019000200401,Jogando luzes sobre os determinantes burocráticos e de gestão da política de assistência social nos municípios brasileiros,Opinião Pública,Ciência Política,2019,2019-2025,TRUE,FALSE,none_detected,"A estratégia foi respaldada no trabalho de Sátyro e Cunha (2018), que usam este como um indicador de baixa capacidade burocrática.",TRUE,diagnostic_not_design
S0104-62762019000300495,A cobertura jornalística das greves gerais de 2017: paradigma de protesto ou militância política,Opinião Pública,Ciência Política,2019,2019-2025,TRUE,FALSE,none_detected,NA,TRUE,diagnostic_not_design
S0104-62762019000300531,Tolerância política no Brasil,Opinião Pública,Ciência Política,2019,2019-2025,TRUE,FALSE,observational_regression_with_causal_claim_no_design,"Usando a primeira variável como dependente, estimamos um modelo linear; e, usando a segunda, um modelo logístico multinomial.",TRUE,diagnostic_not_design
S0104-62762019000300556,O Programa Bolsa Família e seus beneficiários na opinião pública brasileira,Opinião Pública,Ciência Política,2019,2019-2025,TRUE,FALSE,observational_regression_with_causal_claim_no_design,Estimamos tanto um modelo logístico multinomial para avaliar os determinantes do apoio ao PBF quanto regressões via MQO.,TRUE,diagnostic_not_design
S0104-62762019000300577,Relações entre coletivos com as Jornadas de Junho,Opinião Pública,Ciência Política,2019,2019-2025,TRUE,FALSE,none_detected,NA,TRUE,diagnostic_not_design
