pid,title,journal_title,journal_area,year,period_3,credibility_revolution_screen_applicable,credibility_revolution_method_present,method_type,causal_design_quote,tough_call,method_class
S0103-33522014000200227,"Os senadores-empresários: recrutamento, carreira e partidos políticos dos empresários no Senado brasileiro (1986-2010)",Revista Brasileira de Ciência Política,Ciência Política,2014,2012-2018,TRUE,FALSE,none_detected,NA,TRUE,diagnostic_not_design
S0103-33522014000200255,O sistema partidário brasileiro: um debate com a literatura recente,Revista Brasileira de Ciência Política,Ciência Política,2014,2012-2018,TRUE,FALSE,none_detected,NA,TRUE,diagnostic_not_design
S0103-33522015000200121,A cor dos eleitos: determinantes da sub-representa&#231;&#227;o pol&#237;tica dos n&#227;o brancos no Brasil,Revista Brasileira de Ciência Política,Ciência Política,2015,2012-2018,TRUE,FALSE,observational_regression_with_causal_claim_no_design,utilizamos um modelo de regressão linear para estimar o impacto da cor do candidato sobre o montante de recursos capitalizados para a campanha,TRUE,diagnostic_not_design
S0103-33522015000200213,"A agenda da reforma pol&#237;tica no Brasil: autores, objetivos, &#234;xito e fracasso (1988-2010)",Revista Brasileira de Ciência Política,Ciência Política,2015,2012-2018,TRUE,FALSE,none_detected,NA,TRUE,diagnostic_not_design
S0103-33522015000200247,"O perfil do financiamento dos partidos brasileiros (2006-2012): autores, objetivos, &#234;xito e fracasso (1988-2010)",Revista Brasileira de Ciência Política,Ciência Política,2015,2012-2018,TRUE,FALSE,none_detected,NA,TRUE,diagnostic_not_design
S0103-33522015000400119,"Entre o altruísmo e o familismo: a agenda parlamentar feminina e as políticas família-trabalho (Brasil, 2003-2013)",Revista Brasileira de Ciência Política,Ciência Política,2015,2012-2018,TRUE,FALSE,none_detected,NA,TRUE,diagnostic_not_design
S0103-33522015000400147,Conciliação e tensões entre trabalho e família para mulheres titulares do Programa Bolsa Família,Revista Brasileira de Ciência Política,Ciência Política,2015,2012-2018,TRUE,FALSE,none_detected,NA,TRUE,diagnostic_not_design
S0103-33522015000400179,"Domesticidade, trabalho e satisfação pessoal:horas no trabalho doméstico e bem-estar no Estado do Rio de Janeiro",Revista Brasileira de Ciência Política,Ciência Política,2015,2012-2018,TRUE,FALSE,observational_regression_with_causal_claim_no_design,"O objetivo foi o de verificar como as variáveis gênero, nível de instrução, condição conjugal, número de horas trabalhadas no trabalho pago, filhos e proporção de horas dedicadas ao trabalho doméstico pela mulher ... estavam associadas conjuntamente com o Índice de Satisfação.",TRUE,diagnostic_not_design
S0103-33522016000100011,Omissões e seletividades da ciência política brasileira: lacunas temáticas e seus problemas sócio-epistêmicos,Revista Brasileira de Ciência Política,Ciência Política,2016,2012-2018,TRUE,FALSE,none_detected,NA,TRUE,diagnostic_not_design
S0103-33522016000100047,Os desafios da internacionalização: mapeando dinâmicas e rotas da circulação internacional,Revista Brasileira de Ciência Política,Ciência Política,2016,2012-2018,TRUE,FALSE,observational_regression_with_causal_claim_no_design,Para testar o modelo utilizou-se a técnica da regressão logística.,TRUE,diagnostic_not_design
S0103-33522016000100147,Trazendo de volta a mensuração: fundamentos metodológicos do índice de democracia eleitoral,Revista Brasileira de Ciência Política,Ciência Política,2016,2012-2018,TRUE,FALSE,none_detected,NA,TRUE,diagnostic_not_design
S0103-33522016000100199,Qualificando a adesão à democracia: quão democráticos são os democratas brasileiros?,Revista Brasileira de Ciência Política,Ciência Política,2016,2012-2018,TRUE,FALSE,none_detected,NA,TRUE,diagnostic_not_design
S0103-33522016000200007,Corrupção e participação política no Brasil: diagnósticos e consequências,Revista Brasileira de Ciência Política,Ciência Política,2016,2012-2018,TRUE,FALSE,observational_regression_with_causal_claim_no_design,"Realizamos modelos progressivos, que continham inicialmente apenas a variável binária experiência com corrupção, adicionando, em um segundo momento, as variáveis de controle.",TRUE,diagnostic_not_design
S0103-33522016000300077,Da polícia à política: explicando o perfil dos candidatos das Forças Repressivas de Estado à Câmara dos Deputados,Revista Brasileira de Ciência Política,Ciência Política,2016,2012-2018,TRUE,FALSE,none_detected,NA,TRUE,diagnostic_not_design
S0103-33522016000300147,"Diversidade sexual, partidos políticos e eleições no Brasil contemporâneo",Revista Brasileira de Ciência Política,Ciência Política,2016,2012-2018,TRUE,FALSE,none_detected,NA,TRUE,diagnostic_not_design
S0103-33522016000300285,A construção do campo de internet e política: análise dos artigos brasileiros apresentados entre 2000 e 2014,Revista Brasileira de Ciência Política,Ciência Política,2016,2012-2018,TRUE,FALSE,none_detected,NA,TRUE,diagnostic_not_design
S0103-33522016000300321,Estratégias eleitorais de políticos negros no Brasil na era do marketing político,Revista Brasileira de Ciência Política,Ciência Política,2016,2012-2018,TRUE,FALSE,none_detected,NA,TRUE,diagnostic_not_design
S0103-33522017000100007,Uma alternativa para escapar à tabloidização ou uma forma de tabloidização alternativa? O mercado brasileiro de jornais populares e a economia política da imprensa escrita,Revista Brasileira de Ciência Política,Ciência Política,2017,2012-2018,TRUE,FALSE,none_detected,NA,TRUE,diagnostic_not_design
S0103-33522017000200007,A quem se dirigem os editoriais? Um estudo acerca de personagens e instituições mencionadas pelos jornais O Estado de S. Paulo e Folha de S. Paulo,Revista Brasileira de Ciência Política,Ciência Política,2017,2012-2018,TRUE,FALSE,none_detected,NA,TRUE,diagnostic_not_design
S0103-33522017000200035,Sistema de resolução de conflitos e o papel do Senado como Câmara revisora no bicameralismo brasileiro,Revista Brasileira de Ciência Política,Ciência Política,2017,2012-2018,TRUE,FALSE,none_detected,NA,TRUE,diagnostic_not_design
S0103-33522017000200075,Padrões de financiamento eleitoral no Brasil: as receitas de postulantes à Câmara dos Deputados em 2010 e 2014,Revista Brasileira de Ciência Política,Ciência Política,2017,2012-2018,TRUE,FALSE,none_detected,NA,FALSE,diagnostic_not_design
S0103-33522017000200217,"Representação de interesses na Câmara dos Deputados: estratégias, atores e agenda política",Revista Brasileira de Ciência Política,Ciência Política,2017,2012-2018,TRUE,FALSE,none_detected,NA,TRUE,diagnostic_not_design
S0103-33522017000200259,Ação governamental e direitos das mulheres: abrigamento para mulheres ameaçadas de morte no Brasil,Revista Brasileira de Ciência Política,Ciência Política,2017,2012-2018,TRUE,FALSE,none_detected,NA,TRUE,diagnostic_not_design
S0103-33522017000200295,Eleições e debate político on-line em 2014: os comentários no Facebook do jornal O Estado de S. Paulo,Revista Brasileira de Ciência Política,Ciência Política,2017,2012-2018,TRUE,FALSE,none_detected,NA,TRUE,diagnostic_not_design
S0103-33522017000300007,Mudança de valores em países latino-americanos: comparando os índices de pós-materialismo e valores emancipatórios,Revista Brasileira de Ciência Política,Ciência Política,2017,2012-2018,TRUE,FALSE,observational_regression_with_causal_claim_no_design,"Esta medida é regredida, tendo como variável independente os índices de PM e VE, primeiro para a América Latina e depois para cada um dos oito países separadamente.",TRUE,diagnostic_not_design
S0103-33522017000300049,"Os ciclos do presidencialismo de coalizão e seus determinantes político-econômicos,",Revista Brasileira de Ciência Política,Ciência Política,2017,2012-2018,TRUE,FALSE,fixed_effects_causal_panel_claim,"O primeiro será subdividido em um modelo linear com efeitos fixos para a variável disciplina, e um modelo linear com efeitos aleatórios para a variável sucesso. O segundo método de estimação será o GMM para ambas as variáveis.",TRUE,diagnostic_not_design
S0103-33522017000300049,"Os ciclos do presidencialismo de coalizão e seus determinantes político-econômicos,",Revista Brasileira de Ciência Política,Ciência Política,2017,2012-2018,TRUE,FALSE,observational_regression_with_causal_claim_no_design,"O primeiro será subdividido em um modelo linear com efeitos fixos para a variável disciplina, e um modelo linear com efeitos aleatórios para a variável sucesso. O segundo método de estimação será o GMM para ambas as variáveis.",TRUE,diagnostic_not_design
S0103-33522017000300159,Análise da atuação da Câmara Legislativa do Distrito Federal na Era da Informação,Revista Brasileira de Ciência Política,Ciência Política,2017,2012-2018,TRUE,FALSE,observational_regression_with_causal_claim_no_design,"A regressão linear múltipla foi utilizada para investigar a relação entre a variável dependente, satisfação geral, e as variáveis independentes, dimensões da qualidade",TRUE,diagnostic_not_design
S0103-33522017000300223,Simulações de Monte Carlo no ensino de Ciência Política,Revista Brasileira de Ciência Política,Ciência Política,2017,2012-2018,TRUE,FALSE,none_detected,NA,TRUE,diagnostic_not_design
S0103-33522018000100007,"O viés da cobertura política da imprensa nas eleições presidenciais brasileiras de 2002, 2006 e 2010",Revista Brasileira de Ciência Política,Ciência Política,2018,2012-2018,TRUE,FALSE,observational_regression_with_causal_claim_no_design,"Isso pode ser feito a partir de testes de causalidade de Granger, que “verifica se valores anteriores de uma variável aumentam a capacidade de previsão (...) de uma outra variável”.",TRUE,diagnostic_not_design
S0103-33522018000100047,"A execução das emendas orçamentárias individuais: papel de ministros, cargos de liderança e normas fiscais",Revista Brasileira de Ciência Política,Ciência Política,2018,2012-2018,TRUE,FALSE,observational_regression_with_causal_claim_no_design,"Na ausência de uma variável instrumental para contornar o problema, a prudência nos levou, neste trabalho, a aplicar especificações adicionais.",FALSE,diagnostic_not_design
S0103-33522018000100087,Os Sistemas Partidários do Rio Grande do Sul: do Império à Nova República,Revista Brasileira de Ciência Política,Ciência Política,2018,2012-2018,TRUE,FALSE,none_detected,NA,TRUE,diagnostic_not_design
S0103-33522018000100167,Polarização Partidária e Política Externa nos Estados Unidos (1936-2012),Revista Brasileira de Ciência Política,Ciência Política,2018,2012-2018,TRUE,FALSE,none_detected,NA,TRUE,diagnostic_not_design
S0103-33522018000100205,Os condicionantes da aceitação e da rejeição à propaganda negativa na eleição presidencial de 2014,Revista Brasileira de Ciência Política,Ciência Política,2018,2012-2018,TRUE,FALSE,none_detected,NA,TRUE,diagnostic_not_design
S0103-33522018000200007,Eleições como de costume? Uma análise longitudinal das mudanças provocadas nas campanhas eleitorais brasileiras pelas tecnologias digitais (1998-2016),Revista Brasileira de Ciência Política,Ciência Política,2018,2012-2018,TRUE,FALSE,none_detected,NA,FALSE,diagnostic_not_design
S0103-33522018000200063,Political alignments and distributive politics at the municipal level in federal countries,Revista Brasileira de Ciência Política,Ciência Política,2018,2012-2018,TRUE,FALSE,observational_regression_with_causal_claim_no_design,"For all models, random effects wee employed.",TRUE,diagnostic_not_design
S0103-33522018000200107,O Voto em Bloco Individual no Brasil: Notas de Pesquisa sobre a Eleição Senatorial de Duas Vagas,Revista Brasileira de Ciência Política,Ciência Política,2018,2012-2018,TRUE,FALSE,none_detected,NA,TRUE,diagnostic_not_design
S0103-33522018000200131,Audiências públicas interativas na Câmara dos Deputados: além da função informacional,Revista Brasileira de Ciência Política,Ciência Política,2018,2012-2018,TRUE,FALSE,none_detected,NA,TRUE,diagnostic_not_design
S0103-33522018000200187,Explorando a burocracia de médio escalão: uma tentativa de tipologia,Revista Brasileira de Ciência Política,Ciência Política,2018,2012-2018,TRUE,FALSE,none_detected,NA,FALSE,diagnostic_not_design
S0103-33522018000200223,Representação política das pessoas com deficiência na Câmara dos Deputados: a percepção dos representados,Revista Brasileira de Ciência Política,Ciência Política,2018,2012-2018,TRUE,FALSE,none_detected,"Foram enviados mais de 5.180 questionários a pessoas com deficiência de todos os Estados, proporcionalmente à quantidade de Deputados de cada unidade da Federação na Câmara dos Deputados, por meio do Facebook.",TRUE,diagnostic_not_design
S0103-33522018000300009,Financiamento eleitoral empresarial direto e indireto nas eleições nacionais de 2014,Revista Brasileira de Ciência Política,Ciência Política,2018,2012-2018,TRUE,FALSE,observational_regression_with_causal_claim_no_design,A análise dos resultados apresentados na tabela 4 é fundamentada no trabalho de Gujarati (2004) sobre regressão linear múltipla com variáveis “dummy”.,TRUE,diagnostic_not_design
S0103-33522018000300073,Dinâmicas de surgimento de novos partidos na América do Sul (1979-2015),Revista Brasileira de Ciência Política,Ciência Política,2018,2012-2018,TRUE,FALSE,observational_regression_with_causal_claim_no_design,"Para avançarmos na análise, propomos um modelo de regressão logística",TRUE,diagnostic_not_design
S0103-33522018000300105,Indiferenciação e alienação partidária no Brasil,Revista Brasileira de Ciência Política,Ciência Política,2018,2012-2018,TRUE,FALSE,observational_regression_with_causal_claim_no_design,Para testar essa hipótese utilizamos modelos multivariados distintos para cada uma das quatro medidas.,TRUE,diagnostic_not_design
S0103-33522018000300139,Influências do Parlamento Jovem Brasileiro no comportamento político dos egressos: análise da autopercepção dos jovens participantes,Revista Brasileira de Ciência Política,Ciência Política,2018,2012-2018,TRUE,FALSE,observational_regression_with_causal_claim_no_design,“A falta de informações pregressas desse público [...] impossibilitaram a definição de um desenho de pesquisa com técnicas de amostragem probabilística”; a pesquisa utiliza amostra não probabilística por conveniência.,TRUE,diagnostic_not_design
S0103-33522019000100007,Determinantes contextuais da coesão do sistema de crenças democrático: evidências a partir da América Latina,Revista Brasileira de Ciência Política,Ciência Política,2019,2019-2025,TRUE,FALSE,observational_regression_with_causal_claim_no_design,"Para testar estatisticamente essa hipótese, estimamos o coeficiente de correlação intraclasse.",TRUE,diagnostic_not_design
S0103-33522019000100065,Os diretórios partidários municipais e o perfil sociodemográfico dos seus membros,Revista Brasileira de Ciência Política,Ciência Política,2019,2019-2025,TRUE,FALSE,none_detected,NA,FALSE,diagnostic_not_design
S0103-33522019000100161,Ideologia e Discurso: o posicionamento do Partido dos Trabalhadores na oposição e no governo.,Revista Brasileira de Ciência Política,Ciência Política,2019,2019-2025,TRUE,FALSE,none_detected,NA,TRUE,diagnostic_not_design
S0103-33522019000200045,O bipartidarismo em Cabo Verde: a dinâmica do surgimento dos terceiros partidos e a magnitude dos distritos,Revista Brasileira de Ciência Política,Ciência Política,2019,2019-2025,TRUE,FALSE,observational_regression_with_causal_claim_no_design,Usamos regressão linear multivariada em todas as análises; as regressões contam somente com uma variável independente de interesse: a magnitude.,TRUE,diagnostic_not_design
S0103-33522019000200121,The effectiveness of the parliamentary front on sport in the Brazilian National Congress between the World Cup and the Olympic Games,Revista Brasileira de Ciência Política,Ciência Política,2019,2019-2025,TRUE,FALSE,observational_regression_with_causal_claim_no_design,This regression analysis aimed to test four hypotheses to identify which “factor” dictated a greater centrality for a member within FPE network.,TRUE,diagnostic_not_design
S0103-33522019000200155,Judicialização da educação infantil: efeitos da interação entre o Sistema de Justiça e a Administração Pública,Revista Brasileira de Ciência Política,Ciência Política,2019,2019-2025,TRUE,FALSE,none_detected,NA,TRUE,diagnostic_not_design
S0103-33522019000200189,Contexto social de vizinhança: percepções políticas na cidade de São Paulo,Revista Brasileira de Ciência Política,Ciência Política,2019,2019-2025,TRUE,FALSE,observational_regression_with_causal_claim_no_design,"Por não se tratar de uma pesquisa de survey painel, a pesquisa não permite afirmar se em contextos de vizinhança mais homogêneos as opiniões são mais estáveis ao longo do tempo.",TRUE,diagnostic_not_design
S0103-33522019000300113,Juventudes partidárias no Brasil: motivações e perspectivas dos jovens filiados a partidos políticos,Revista Brasileira de Ciência Política,Ciência Política,2019,2019-2025,TRUE,FALSE,none_detected,NA,TRUE,diagnostic_not_design
S0103-33522020000100007,Novos atores políticos de esquerda nas redes sociais: o uso do Facebook pelas lideranças do Podemos e do Bloco de Esquerda,Revista Brasileira de Ciência Política,Ciência Política,2020,2019-2025,TRUE,FALSE,none_detected,NA,TRUE,diagnostic_not_design
S0103-33522020000100123,Pesquisa bibliométrica e hierarquias do conhecimento em Ciência Política,Revista Brasileira de Ciência Política,Ciência Política,2020,2019-2025,TRUE,FALSE,none_detected,NA,TRUE,diagnostic_not_design
S0103-33522020000200043,&#8220;Revisitando&#8221; algumas teses do passado: a eleição de 2006 e a disputa antagônica entre PT e PSDB,Revista Brasileira de Ciência Política,Ciência Política,2020,2019-2025,TRUE,FALSE,none_detected,NA,TRUE,diagnostic_not_design
S0103-33522020000200323,O impacto da educação integral na participação das mães no mercado de trabalho e no trabalho infantil: Uma avaliação de impacto do Programa Mais Educação por regressão descontínua,Revista Brasileira de Ciência Política,Ciência Política,2020,2019-2025,TRUE,TRUE,regression_discontinuity,"A partir de 2012, temos, portanto, uma descontinuidade nos critérios de adesão ao programa... Tem-se, assim, a possibilidade de avaliação de impacto do programa por meio de modelos de regressão descontínua fuzzy.",FALSE,strict_design_method
S0103-33522020000200323,O impacto da educação integral na participação das mães no mercado de trabalho e no trabalho infantil: Uma avaliação de impacto do Programa Mais Educação por regressão descontínua,Revista Brasileira de Ciência Política,Ciência Política,2020,2019-2025,TRUE,TRUE,instrumental_variables,"A partir de 2012, temos, portanto, uma descontinuidade nos critérios de adesão ao programa... Tem-se, assim, a possibilidade de avaliação de impacto do programa por meio de modelos de regressão descontínua fuzzy.",FALSE,strict_design_method
S0103-33522020000200323,O impacto da educação integral na participação das mães no mercado de trabalho e no trabalho infantil: Uma avaliação de impacto do Programa Mais Educação por regressão descontínua,Revista Brasileira de Ciência Política,Ciência Política,2020,2019-2025,TRUE,TRUE,difference_in_differences,"A partir de 2012, temos, portanto, uma descontinuidade nos critérios de adesão ao programa... Tem-se, assim, a possibilidade de avaliação de impacto do programa por meio de modelos de regressão descontínua fuzzy.",FALSE,strict_design_method
S0103-33522020000200323,O impacto da educação integral na participação das mães no mercado de trabalho e no trabalho infantil: Uma avaliação de impacto do Programa Mais Educação por regressão descontínua,Revista Brasileira de Ciência Política,Ciência Política,2020,2019-2025,TRUE,TRUE,matching_or_weighting,"A partir de 2012, temos, portanto, uma descontinuidade nos critérios de adesão ao programa... Tem-se, assim, a possibilidade de avaliação de impacto do programa por meio de modelos de regressão descontínua fuzzy.",FALSE,strict_design_method
S0103-33522020000300204,Posicionamento dos partidos políticos brasileiros na escala esquerda-direita: dilemas metodológicos e revisão da literatura,Revista Brasileira de Ciência Política,Ciência Política,2020,2019-2025,TRUE,FALSE,none_detected,NA,TRUE,diagnostic_not_design
S0103-33522020000300205,Governabilidade e lógica de designações no Ministério Público Federal: os &#8220;procuradores políticos profissionais&#8221;,Revista Brasileira de Ciência Política,Ciência Política,2020,2019-2025,TRUE,FALSE,none_detected,“Outro limite deste estudo refere-se [...] não permitir concluir sobre o resultado das designações na atuação prática dos integrantes do MPF”.,TRUE,diagnostic_not_design
S0103-33522020000300206,Aplicação metodológica da análise de conteúdo em pesquisas de análise de política externa,Revista Brasileira de Ciência Política,Ciência Política,2020,2019-2025,TRUE,FALSE,none_detected,NA,TRUE,diagnostic_not_design
S0103-33522020000300207,A atuação do jornalismo editorial no escândalo JBS: uma análise comparativa sobre os jornais Folha de S. Paulo e O Estado de S. Paulo,Revista Brasileira de Ciência Política,Ciência Política,2020,2019-2025,TRUE,FALSE,none_detected,NA,TRUE,diagnostic_not_design
S0103-33522020000300209,O efeito das cotas: desempenho acadêmico dos estudantes cotistas da Universidade Federal de Viçosa - Campus Rio Paranaíba,Revista Brasileira de Ciência Política,Ciência Política,2020,2019-2025,TRUE,FALSE,none_detected,NA,TRUE,diagnostic_not_design
S0103-33522021000100204,O hábito de frequentar cultos como mecanismo de mobilização eleitoral: o voto evangélico em Bolsonaro em 2018,Revista Brasileira de Ciência Política,Ciência Política,2021,2019-2025,TRUE,FALSE,observational_regression_with_causal_claim_no_design,[...] investigar aspectos da relação entre religião e voto com foco nos mecanismos causais a partir de dados observacionais.,TRUE,diagnostic_not_design
S0103-33522021000100207,A Ciência na Ciência Política brasileira,Revista Brasileira de Ciência Política,Ciência Política,2021,2019-2025,TRUE,FALSE,observational_regression_with_causal_claim_no_design,Elaboramos um modelo de regressão com o indicador de cientificidade ortodoxa como preditor e o coeficiente de valor dos periódicos como resultante.,TRUE,diagnostic_not_design
S0103-33522021000100209,Entre o idealizado e o obtido: uma análise dos efeitos das primárias abertas na Argentina dez anos após sua incorporação formal,Revista Brasileira de Ciência Política,Ciência Política,2021,2019-2025,TRUE,FALSE,none_detected,NA,TRUE,diagnostic_not_design
S0103-33522021000200201,Taxonomia das diretrizes para educação nos planos de governo dos elegíveis à Presidência da República Brasileira (2018),Revista Brasileira de Ciência Política,Ciência Política,2021,2019-2025,TRUE,FALSE,none_detected,NA,TRUE,diagnostic_not_design
S0103-33522021000200204,"Federalismo e execução dos serviços públicos de atendimento do governo federal: a experiência brasileira nas políticas sociais,",Revista Brasileira de Ciência Política,Ciência Política,2021,2019-2025,TRUE,FALSE,none_detected,NA,FALSE,diagnostic_not_design
S0103-33522021000200205,Hibridismo como um estilo nacional de políticas públicas: trajetórias e dilemas dos enfoques majoritário e consensual no Brasil,Revista Brasileira de Ciência Política,Ciência Política,2021,2019-2025,TRUE,FALSE,none_detected,NA,TRUE,diagnostic_not_design
S0103-33522021000200206,Organização de novos partidos políticos: entre estratégias de cooptação e contestação,Revista Brasileira de Ciência Política,Ciência Política,2021,2019-2025,TRUE,FALSE,none_detected,NA,TRUE,diagnostic_not_design
S0103-33522021000200401,O impacto da pandemia de Covid-19 na atuação da burocracia de nível de rua no Brasil,Revista Brasileira de Ciência Política,Ciência Política,2021,2019-2025,TRUE,FALSE,none_detected,NA,TRUE,diagnostic_not_design
S0103-33522021000200402,Judicialização da política no enfrentamento à Covid-19: um novo padrão decisório do STF?,Revista Brasileira de Ciência Política,Ciência Política,2021,2019-2025,TRUE,FALSE,none_detected,NA,TRUE,diagnostic_not_design
S0103-33522021000300202,Reflexões sobre nomeações a cargos públicos no Brasil: a experiência de três secretarias entre 2011 e 2018,Revista Brasileira de Ciência Política,Ciência Política,2021,2019-2025,TRUE,FALSE,none_detected,NA,TRUE,diagnostic_not_design
S0103-33522021000300204,O debate sobre a &#8220;Lei da Palmada&#8221; na Câmara dos Deputados,Revista Brasileira de Ciência Política,Ciência Política,2021,2019-2025,TRUE,FALSE,none_detected,NA,TRUE,diagnostic_not_design
S0103-33522021000300401,Combate à pandemia de covid-19 e sucesso eleitoral nas capitais brasileiras em 2020,Revista Brasileira de Ciência Política,Ciência Política,2021,2019-2025,TRUE,FALSE,none_detected,A técnica constitui um poderoso instrumento de inferência causal cruzada de dados ao vincular um resultado de interesse a condições causais.,TRUE,diagnostic_not_design
