audit_check,severity,pid,title,journal_title,is_empirical_paper,empirical_evidence_type,is_empirical_quant_paper_torreblanca,quantitative_analysis_type,quantitative_analysis_evidence_quote,has_statistical_inference,statistical_inference_quote,tough_call,tough_call_reason,brief_justification
statistical_inference_missing_within_quantitative,warning,S0102-64452007000300002,Repensando o presidencialismo: contestações e quedas de presidentes na América do Sul,Lua Nova: Revista de Cultura e Política,TRUE,mixed_empirical,TRUE,statistical_modeling,"Nas conclusões desta seção, apresento resultados probabilísticos de um modelo de regressão logística das variáveis dependentes.",NA,NA,TRUE,"A classificação exige distinguir a regressão logística e a linguagem de risco de um método de credibilidade revolucionária. O artigo tem análise quantitativa própria e reivindicações explicativas, mas não apresenta estratégia explícita de identificação causal nem medidas claras de incerteza no corpo fornecido.","O artigo é empiricamente misto: combina codificação quantitativa e regressão logística com reconstruções qualitativas de contestações presidenciais. A análise é observacional e explicativa, mas não utiliza método de credibilidade revolucionária; portanto, o modelo é classificado como regression with causal claim no design."
statistical_inference_missing_within_quantitative,warning,S0104-62762012000100005,"Atitudes, cognição e participação política: padrões de influência dos ambientes de socialização sobre o perfil político dos jovens",Opinião Pública,TRUE,quantitative_only,TRUE,statistical_modeling,A redução das duas variáveis ... a apenas um construto latente foi feita por meio da Análise Fatorial Exploratória por Eixos Principais.,NA,NA,TRUE,"A classificação como modelagem é clara pela análise fatorial e pelas referências a modelos, mas o corpo fornecido não informa a família exata dos modelos nem seus resultados inferenciais. Além disso, há a inconsistência entre 3513 e 351 casos.","É um artigo empírico quantitativo baseado em survey próprio, com análise fatorial e modelos para estimar relações entre características de socialização e resultados políticos juvenis. Faz alegações explicativas, mas não apresenta método de credibilidade da revolução nem identificação causal explícita."
statistical_inference_missing_within_quantitative,warning,S0104-62762014000300425,Explicando os efeitos de programas de socialização política: a experiência do Parlamento Jovem no Brasil,Opinião Pública,TRUE,quantitative_only,TRUE,statistical_modeling,"Além da variável de tratamento, incluímos em nossos modelos de regressão algumas variáveis com o objetivo de controlar os efeitos.",NA,NA,TRUE,"O texto apresenta um desenho quase experimental com comparação pré/pós e grupo de controle, mas não explicita um estimador DiD, tendências paralelas ou outra identificação formal; por isso, o método é codificado como outro método causal moderno, não como DiD.","O artigo apresenta evidência quantitativa própria de survey e modelos de regressão para estimar efeitos do Parlamento Jovem. Não há componente qualitativo substantivo. A reivindicação causal é apoiada por um desenho quase experimental e por seleção de controles semelhantes, embora a identificação não seja formalizada como um método padrão da revolução da credibilidade."
statistical_inference_missing_within_quantitative,warning,S0103-33522019000200189,Contexto social de vizinhança: percepções políticas na cidade de São Paulo,Revista Brasileira de Ciência Política,TRUE,quantitative_only,TRUE,statistical_modeling,"Usando o método de redução de valores componentes principais e o método de rotação fatorial ortogonal Varimax, a análise fatorial resultou na extração de dois fatores explicando 98,7% da variabilidade dos dados.",NA,NA,TRUE,"O artigo combina modelagem estatística e linguagem de influência, mas usa dados observacionais e reconhece que não pode estabelecer influência causal. Foi necessário distinguir a regressão ordinal e a análise fatorial, que contam como modelagem quantitativa, de um método de credibilidade revolucionária, que não está presente.","É um artigo empírico quantitativo com análise fatorial, estatísticas descritivas e regressão ordinal multivariada aplicada a survey e dados eleitorais. Não apresenta evidência qualitativa nem desenho causal moderno; portanto, a análise quantitativa é statistical_modeling, mas o método de credibilidade revolucionária está ausente."
statistical_inference_missing_within_quantitative,warning,S0104-44782012000400011,"Processo decisório no Supremo Tribunal Federal: coalizões e ""panelinhas""",Revista de Sociologia e Política,TRUE,quantitative_only,TRUE,statistical_modeling,buscamos controlar a influência das diferentes composições do tribunal na explicação do nível de coesão da corte utilizando um modelo de regressão logística,NA,NA,TRUE,"O artigo apresenta regressão logística e hipóteses explicativas, mas não apresenta desenho de identificação causal nem medidas explícitas de incerteza estatística. Assim, deve ser incluído na triagem quantitativa, mas não classificado como uso de método da revolução da credibilidade.","É um artigo empírico quantitativo que analisa dados próprios de decisões e votações do STF, utilizando estatísticas descritivas, medidas de associação, comparações entre blocos e regressão logística. Faz reivindicações explicativas, mas não emprega um desenho causal moderno ou uma estratégia explícita de identificação."
statistical_inference_outside_quantitative_definition,warning,S0104-44782009000100008,Justiça penal autoritária e consolidação do estado punitivo no Brasil,Revista de Sociologia e Política,TRUE,qualitative_only,FALSE,none,NA,TRUE,“com margem de erro 4%”,TRUE,"O artigo não apresenta desenho explícito nem coleta sistemática, mas interpreta legislação, discursos, relatórios e um caso judicial concreto. Pela definição ampla do schema, isso sustenta a classificação como empírico qualitativo, embora o texto também tenha caráter ensaístico.","Trata-se de uma análise qualitativa interpretativa e explicativa sobre a Justiça Penal brasileira, baseada em documentos legais, discursos, fontes secundárias e reconstrução de caso. Os números apresentados são secundários e descritivos, sem análise quantitativa própria; por isso, a classificação quantitativa é none e o artigo não é um paper quantitativo Torreblanca."
